3	YOU BUTTON UP	$98	SHIRT/BLOUSE ($53)	COAT/JACKET ($40)	SWEATER ($5)
4	OCCUPATION ASSOCIATED WITH CARS	$83	MECHANIC ($40)	(TAXI/CAB)+DRIVER ($18)	[CAR+]SALES* ($14)	RACE[+CAR]+DRIVER ($11)
7	IN A CHILD'S SCHOOLBAG	$98	PENCILS/PENS ($41)	BOOKS ($35)	CRAYONS ($6)	LUNCH/SNACKS ($5)	NOTEBOOK/TABLET/PAPER/PADS ($4)	HOMEWORK ($4)	RULER ($3)
6	MONTH YOU GET THE MOST COLDS	$98	JAN[UARY] ($44)	DEC[EMBER] ($17)	FEB[RUARY] ($15)	MAR[CH] ($14)	NOV[EMBER] ($5)	APR[IL] ($3)
10	BIG FIGHTS DO YOU HAVE WITH YOUR SPOUSE IN A YEAR	$97	2 ($24)	3 ($22)	5 ($11)	1 ($10)	10 ($9)	0 ($6)	6 ($6)	4 ($5)	12 ($2)	364 ($2)
4	TIMES A WEEK DO YOU WATER YOUR HOUSEPLANTS	$96	1 ($59)	2 ($30)	3 ($5)	7 ($2)
9	SOFT	$83	COTTON ($31)	PILLOW ($25)	FEATHERS ($7)	BABY ($5)	MARSHMALLOW ($5)	FUR ($3)	VELVET ($3)	BUNNY/RABBIT ($2)	TISSUE/KLEENEX ($2)
8	THAT'S EXPENSIVE TO REPLACE	$91	CAR/AUTO* ($43)	JEWELRY/DIAMONDS ($15)	HOUSE/HOME ($13)	TV[+SET]/TELEVISION ($8)	ANTIQUES ($4)	CHINA ($4)	FURNITURE ($2)	WINDOW ($2)
12	STATE WHERE YOU'D EXPECT TO SEE LOTS OF WILDLIFE	$88	ALASKA/AK ($17)	COLORADO/CO ($16)	MONTANA/MT ($15)	WYOMING/WY ($11)	FLORIDA/FL ($8)	ARIZONA/AZ ($3)	MAINE/ME ($3)	OREGON/OR ($3)	TENNESSEE/TN ($3)	TEXAS/TX ($3)	WASHINGTON/WA ($3)	WISCONSIN/WI ($3)
4	PART OF A PLANT	$99	LEAF ($46)	STEM ($33)	ROOT ($15)	FLOWER/BLOSSOM ($5)
5	MINUTES DOES IT TAKE TO EAT BREAKFAST	$99	15 ($51)	10 ($24)	20 ($10)	30 ($9)	5 ($5)
12	APPROXIMATELY HOW MUCH DID YOU PAY FOR YOUR FIRST CAR	$75	500 ($15)	1000 ($15)	2000 ($7)	3000 ($6)	400 ($5)	2500 ($5)	3500 ($5)	200 ($4)	4000 ($4)	75 ($3)	100 ($3)	800 ($3)
3	COLOR THAT GREEN GRASS BECOMES	$97	BROWN ($49)	YELLOW ($46)	WHITE ($2)
4	BUSIEST DAY OF THE WEEK	$99	FRI[DAY] ($42)	MON[DAY] ($31)	SAT[URDAY] ($23)	TUE[SDAY] ($3)
12	BREED OF DOG	$77	POODLE/* POODLE ($19)	GERM+SHEP/SHEPHERD/SHEPERD/GERMAN SHEP ($6)	SPANIEL/COCKER ($12)	COLLIE ($10)	TERRIER ($6)	DACHSHUND/DAKSHUND ($5)	IRISH+SET[TER] ($5)	CHIHUAHUA ($4)	S[AIN]T+BERNARD ($4)	BEAGLE ($2)	LABRADOR/[*+]RETRIEVER ($2)	SAMOYED ($2)
7	HOW FEW HOURS OF SLEEP CAN YOU GET BY ON	$99	6 ($29)	5 ($28)	4 ($24)	3 ($7)	2 ($4)	7 ($4)	8 ($3)
9	BESIDES A CAR THAT HAS A MOTOR	$92	BOAT ($27)	MOTORCYCLE/MOTORBIKE ($27)	LAWN+MOWER ($12)	[AIR]PLANE ($10)	BUS ($5)	REFRIGERATOR/FRIDGE ($5)	DRYER ($2)	TRACTOR ($2)	TRUCK ($2)
3	PEOPLE PUT ON BREAKFAST CEREAL	$100	MILK ($44)	SUGAR ($37)	FRUIT/BANANAS/STRAWBERRIES ($19)
11	CARDS DO YOU USUALLY RECEIVE ON YOUR BIRTHDAY	$96	10 ($28)	5 ($23)	6 ($12)	3 ($7)	2 ($6)	4 ($6)	12 ($5)	7 ($3)	15 ($2)	20 ($2)	25 ($2)
12	STATE IN THE MIDWEST	$95	KANSAS/KS ($24)	ILLINOIS/IL ($22)	IOWA/IA ($8)	MISSOURI/MO ($8)	NEBRASKA/NE ($6)	OKLAHOMA/OK ($6)	INDIANA/IN ($5)	MINNESOTA/MN ($4)	WYOMING/WY ($4)	SOUTH DAKOTA/SD ($3)	WISCONSIN/WI ($3)	IDAHO/ID ($2)
7	THAT'S FUN TO RIDE ON	$98	ROLL+COAST/ROLLER+COASTER ($47)	HORSE ($19)	MOTORCYCLE ($10)	FERRIS+WHL/FERRIS+WHEEL ($8)	CAROUSEL/MERRY+GO+ROUND ($8)	SKATEBOARD ($3)	SWING ($3)
4	FRUIT TREE	$86	APPLE ($56)	PEACH ($15)	CHERRY ($8)	ORANGE ($7)
9	INGREDIENT IN CASSEROLES	$93	MACARONI/NOODLES/PASTA ($51)	MEAT ($15)	CHEESE ($9)	TUNA+[FISH] ($5)	EGGS ($3)	MILK ($3)	TOM[ATO]+SAUCE ($3)	CHICKEN ($2)	SOUP ($2)
8	LITTLE BOYS LIKE THAT LITTLE GIRLS DON'T	$93	FROGS/TOADS ($31)	SNAKES ($20)	BUGS ($17)	WORMS ($9)	SPORTS/FISHING ($7)	TRUCKS ($5)	CARS ($2)	GUNS ($2)
11	OCCUPATION THAT USES A TRUCK	$90	(TRASH/GARBAGE)+COLLECT ($20)	MOVER/MOVING ($17)	DELIVERY ($16)	TRUCK+DRIV(ER/ING) ($15)	FARMER/FARMING ($4)	HAULING ($4)	PLUMB(ER/ING) ($4)	MILKMAN ($3)	TOWING/WRECKER ($3)	FURNITURE ($2)	LANDSCAPING ($2)
12	DIFFERENT CHANNELS DOES YOUR TV GET	$85	7 ($12)	8 ($11)	10 ($10)	12 ($10)	6 ($9)	5 ($8)	15 ($8)	14 ($4)	20 ($4)	4 ($3)	24 ($3)	30 ($3)
4	ILLNESS AN ENTIRE FAMILY MIGHT CATCH	$98	FLU ($52)	COLD ($39)	MEASLES ($4)	STREP[+THROAT] ($3)
8	WHAT'S THE MOST YOU'D PAY FOR A NEW CAR	$91	10000 ($25)	8000 ($18)	6000 ($16)	7000 ($15)	9000 ($5)	5500 ($4)	12000 ($4)	15000 ($4)
3	NAME ONE OF THE *BEATLES*	$98	[J[OHN]+]LENNON/JOHN ($43)	[R[INGO]+]STARR/RINGO ($34)	[P[AUL]+]MCCARTNEY/PAUL ($21)
10	MONTHS DOES A HIGH SCHOOL ROMANCE LAST	$97	6 ($28)	12 ($17)	3 ($15)	24 ($14)	1 ($7)	36 ($5)	8 ($4)	9 ($3)	2 ($2)	18 ($2)
5	A PRIEST WEARS	$97	FROCK/ROBE/CASSOCK ($37)	COLLAR ($33)	CROSS/CRUCIFIX ($20)	ROSARY ($4)	PANTS ($3)
7	COLOR OF CARPET IN YOUR LIVING ROOM	$93	GREEN ($24)	BROWN ($22)	GOLD ($16)	BEIGE/TAN ($11)	RUST ($9)	BLUE ($8)	RED ($3)
9	POUNDS DOES A FOOTBALL PLAYER WEIGH	$91	200 ($23)	225 ($16)	250 ($16)	210 ($11)	220 ($9)	230 ($5)	180 ($4)	240 ($4)	185 ($3)
9	BOOKS DO YOU BUY IN A YEAR	$87	5 ($24)	10 ($17)	2 ($10)	12 ($10)	4 ($8)	3 ($6)	6 ($5)	15 ($4)	0 ($3)
7	GLASSES OF WATER DO YOU DRINK EACH DAY	$97	2 ($30)	3 ($18)	4 ($18)	1 ($12)	6 ($7)	5 ($6)	8 ($6)
10	SPORT THAT THE WHOLE FAMILY CAN PLAY TOGETHER	$95	BASEBALL/SOFTBALL ($23)	BOWLING ($18)	VOLLEYBALL ($15)	TENNIS ($8)	GOLF ($7)	BADMINTON ($6)	CROQUET ($5)	SWIMMING ($5)	FOOTBALL ($4)	FRISBEE ($4)
9	YEARS HAVE YOU WORKED AT YOUR PRESENT JOB	$78	5 ($21)	10 ($17)	20 ($10)	15 ($9)	2 ($6)	3 ($4)	7 ($4)	8 ($4)	30 ($3)
3	NAME YOUR FAVORITE TV NETWORK	$97	ABC ($55)	NBC ($24)	CBS ($18)
8	AGE WHEN YOU GOT YOUR FIRST JOB	$97	16 ($35)	15 ($16)	17 ($12)	14 ($11)	12 ($8)	13 ($6)	18 ($6)	19 ($3)
9	YEARS HAVE YOU KNOWN YOUR BEST FRIEND	$77	10 ($26)	20 ($15)	5 ($8)	15 ($6)	25 ($5)	30 ($5)	12 ($4)	13 ($4)	40 ($4)
8	HOW MUCH DOES A NEW WARDROBE COST	$91	1000 ($35)	500 ($23)	2000 ($11)	3000 ($6)	5000 ($5)	1500 ($4)	2500 ($4)	300 ($3)
3	PLACE THAT GETS VERY STEAMY	$93	BATHROOM/SHOWER ($46)	SAUNA ($30)	STEAM+[BATH/ROOM] ($17)
4	SEASON YOU MOST LOOK FORWARD TO	$100	SPRING ($51)	SUMMER ($43)	FALL/AUTUMN ($4)	WINTER ($2)
2	*EXTRA* PEOPLE WANT ON A NEW CAR	$93	AIR COND/AIR+CONDITION ($47)	RADIO/STEREO/TAPE/MUSIC ($46)
7	WHAT'S THE MOST FLIGHTS OF STAIRS YOU'VE EVER CLIMBED AT ONE TIME	$82	5 ($19)	10 ($18)	6 ($12)	3 ($11)	4 ($11)	8 ($6)	20 ($5)
4	HOLIDAY WHEN YOU THINK FLORISTS DO THE MOST BUSINESS	$100	MOTHERS+DAY ($40)	VALENTINE[']S ($36)	EASTER ($15)	CHRISTMAS/X+MAS ($9)
7	WHAT'S THE MOST MONEY YOU'D PAY FOR SHOES	$81	50 ($19)	30 ($15)	40 ($15)	25 ($10)	35 ($10)	45 ($7)	20 ($5)
6	HOUR AT WHICH YOU GET DRESSED ON SUNDAY	$92	9 ($28)	10 ($26)	11 ($16)	12 ($11)	8 ($8)	7 ($3)
8	REAL ANIMAL SEEN IN SCARY DREAMS	$88	SNAKE ($21)	BEAR ($20)	LION ($13)	WOLF ($12)	DOG ($7)	BAT ($6)	GORILLA ($5)	CAT ($4)
10	LETTERS DO YOU WRITE PER YEAR	$69	10 ($13)	25 ($9)	2 ($7)	12 ($7)	20 ($7)	50 ($7)	6 ($5)	15 ($5)	100 ($5)	0 ($4)
5	MILES DO MOST PEOPLE TRAVEL TO WORK EACH DAY	$89	10 ($40)	5 ($18)	15 ($14)	20 ($14)	2 ($3)
5	AGE WHEN A BOY'S VOICE CHANGES	$99	13 ($36)	14 ($29)	12 ($19)	15 ($12)	16 ($3)
6	COLOR OF POOL BALLS	$97	BLACK ($37)	WHITE ($22)	RED ($21)	YELLOW ($7)	BLUE ($5)	GREEN ($5)
10	AT WHAT AGE DO CHILDREN BECOME INTERESTING TO TALK WITH	$90	10 ($17)	12 ($14)	4 ($12)	3 ($10)	5 ($10)	6 ($7)	16 ($7)	13 ($5)	7 ($4)	8 ($4)
8	MINUTES DOES IT TAKE BEFORE YOU'RE REALLY AWAKE IN THE MORNING	$99	15 ($29)	10 ($21)	5 ($17)	30 ($14)	2 ($7)	60 ($5)	1 ($3)	20 ($3)
9	AT WHAT AGE DO MANY PEOPLE BEGIN A *SECOND CHILDHOOD*	$87	40 ($18)	50 ($13)	70 ($11)	75 ($11)	45 ($8)	60 ($7)	65 ($7)	80 ($7)	30 ($5)
6	PLACE CHILDREN THINK MONSTERS HIDE	$92	CLOSETS ($35)	UNDER+[THE+]BED ($35)	BASEMENTS/CELLAR ($8)	CAVES ($7)	WOODS ($4)	ATTICS ($3)
2	WAY PEOPLE REWARD THEIR DOG	$98	FOOD/TREAT ($65)	PAT+ON+HEAD/PET[TING]/PAT[HEAD] ($33)
4	MINUTES DO KIDS SPEND ON THEIR HOMEWORK EACH NIGHT	$95	60 ($55)	30 ($28)	120 ($8)	15 ($4)
8	HIGH IQ SCORE	$74	150 ($19)	140 ($17)	160 ($9)	180 ($8)	120 ($7)	135 ($6)	130 ($5)	100 ($3)
6	ENEMIES DO YOU HAVE	$97	0 ($40)	2 ($19)	1 ($18)	3 ($10)	4 ($5)	5 ($5)
4	NAME ANY US COIN	$86	DIME ($26)	QUARTER ($22)	PENNY ($21)	SLVR+DOLLAR/SILVER+DOLLAR ($17)
5	MINUTES DO YOU SPEND AT A SUPERMARKET	$94	60 ($40)	30 ($29)	45 ($16)	90 ($5)	120 ($4)
6	HOW MUCH CASH IN DOLLARS DO YOU CARRY AROUND WITH YOU	$87	20 ($30)	10 ($27)	5 ($15)	30 ($6)	15 ($5)	0 ($4)
5	AGE WHEN CHILDREN SHOULD START SUPPORTING THEMSELVES	$92	18 ($42)	21 ($22)	20 ($11)	19 ($9)	22 ($8)
10	SOUND YOU REALLY HATE	$71	NAILS[+ON]+BOARD/FINGERNAILS/BLACKBOARD ($33)	SIREN/WHISTLE ($10)	ROCK+MUSIC/DISCO ($5)	SCREECH ($5)	[AIR]PLANES ($3)	ALARM+CLOCK/ALARM ($3)	BUZZER ($3)	DRILL ($3)	BARK/DOG ($3)	NOISY+KIDS/CHILDREN ($3)
9	ON A NEW CAR THAT GOES BAD QUICKLY	$71	TIRES ($25)	BRAKES ($9)	CLOCK ($8)	AIR+COND/AIR+CONDITION[ER/ING] ($6)	BODY ($6)	CARBURETOR ($5)	MUFFLER ($5)	LIGHTS ($4)	WIPERS ($3)
9	THAT CLICKS	$86	LOCK ($21)	WATCH ($19)	CAMERA ($12)	PEN ($11)	SWITCH ($11)	LATCH ($3)	FINGERS ($3)	GUN ($3)	SHOE/HEEL ($3)
9	TYPE OF PRODUCT THAT'S MADE IN A *DAINTIER* STYLE FOR LADIES	$67	DEODORANT ($17)	PANTS/JEANS ($8)	[ELECTRIC+]RAZOR ($8)	SOAP ($8)	UMBRELLA ($8)	HANKY/HANDKERCHIEF ($6)	GLOVES ($4)	PERFUME/COLOGNE ($4)	SHOES ($4)
5	YOU OCCASIONALLY SPLURGE ON	$90	DINNER/ENTERTAINMENT/FOOD/MEALS ($38)	CLOTHES ($34)	SWEETS/DESSERT ($12)	LOVED+ONES/RELATIVES ($3)	VACATION/TRAVEL/HOLIDAY ($3)
5	YOU SEE IN THE SKY	$80	CLOUDS ($36)	STARS ($20)	SUN ($9)	MOON ($8)	SMOG ($7)
3	SPORT THAT HAS A HALL OF FAME	$99	BASEBALL ($67)	FOOTBALL ($30)	BASKETBALL ($2)
6	PLACE PEOPLE SPEND HOURS JUST DAYDREAMING	$85	PARK ($32)	SCHOOL ($25)	HOME ($13)	BEACH ($8)	CAR ($4)	WORK ($3)
2	YOU HAVE SPARE KEYS FOR	$100	CAR ($52)	HOUSE ($48)
9	HOURS A DAY DOES A TOP EXECUTIVE WORK	$94	10 ($26)	8 ($17)	6 ($16)	12 ($13)	4 ($8)	5 ($4)	14 ($4)	2 ($3)	9 ($3)
7	HOW OLD WERE YOU IN YOUR FIRST MEMORIES OF YOURSELF	$95	3 ($25)	5 ($24)	4 ($19)	6 ($11)	2 ($8)	7 ($5)	10 ($3)
2	COUPLES FIGHT ABOUT EVEN AFTER THE DIVORCE	$97	KIDS/CHILDREN ($60)	ALIMONY/MONEY ($37)
2	ANIMALS DO WHEN THEY'RE ANGRY	$93	BITE/FIGHT ($49)	BARK/GROWL/YELP/HISS ($44)
8	AT WHAT HOUR ARE YOU THE MOST ENERGETIC	$79	10 ($25)	12 ($15)	9 ($11)	2 ($7)	8 ($6)	1 ($6)	11 ($5)	3 ($4)
10	MINUTES DOES IT TAKE YOU TO GET UP AFTER THE ALARM GOES OFF	$95	10 ($24)	5 ($19)	15 ($16)	1 ($7)	20 ($7)	30 ($7)	2 ($6)	3 ($3)	60 ($3)	0 ($3)
3	USED-CAR SALESMEN LIE ABOUT	$78	MILEAGE ($42)	[CAR[']S+]CONDITION ($27)	[FORMER/PREVIOUS+]OWNERS ($9)
4	KIND OF PLACE YOU GET HUNGRY JUST BY SMELLING THE FOOD	$99	BAKERY ($47)	RESTAURANT ($45)	FAIR ($4)	KITCHEN ($3)
7	THAT CAUSES ACHES AND PAINS	$73	EXERCISE/JOGGING ($22)	FLU/COLD ($19)	ARTHRITIS ($11)	ACCIDENT ($6)	[BAD+]WEATHER ($5)	TOOTH+ACHE ($5)	WORK ($5)
8	ON A SCALE OF 1 TO 10 HOW IMPORTANT ARE LOOKS IN A PARTNER	$94	5 ($35)	7 ($16)	8 ($11)	6 ($10)	2 ($8)	4 ($5)	1 ($5)	10 ($4)
7	HOW MUCH IN DOLLARS DOES IT COST TO HAVE A BABY	$81	1000 ($23)	2000 ($22)	1500 ($13)	500 ($8)	1200 ($6)	3000 ($5)	5000 ($4)
7	PEOPLE DO TO GET A BREAK ON THEIR TAXES	$85	CHEAT/LIE ($35)	DONATE[+MONEY]/GIVE[+TO+]CHARITY ($32)	HAVE+KIDS/CHILDREN/DEPENDENTs ($5)	[BUY+](PROPERTY/REAL+ESTATE) ($4)	DEDUCTIONS/BUSINESS ($3)	EXEMPTIONS ($3)	GET+MARRIED ($3)
6	ON A SCALE OF 1 TO 10 HOW NICE ARE YOU	$96	8 ($29)	7 ($24)	10 ($17)	9 ($11)	5 ($8)	6 ($7)
6	AGE AT WHICH A WOMAN SHOULD GET MARRIED	$90	25 ($24)	21 ($19)	22 ($19)	23 ($15)	24 ($8)	20 ($5)
7	ABOUT WHICH MOST MEN ARE BOYS AT HEART	$83	SPORTS/FISHING ($30)	TOYS ($20)	CARS/RACES ($19)	(CHRIST/X+)MAS ($4)	PRESENTS/GIFTS ($4)	GAMES ($3)	HOBBIES ($3)
7	PEOPLE DO YOU TRULY DISLIKE	$87	3 ($21)	5 ($15)	0 ($13)	2 ($13)	1 ($10)	10 ($9)	4 ($6)
3	WOULD YOU RATHER LIVE IN THE PAST PRESENT OR FUTURE	$100	PRESENT ($57)	PAST ($25)	FUTURE ($18)
3	GIVE ME ANOTHER WORD FOR *CRY*	$97	WEEP ($45)	SOB ($30)	BAWL ($22)
8	WOMAN'S HOBBY	$81	SEWING ($21)	KNITTING ($19)	TENNIS ($10)	MEN ($8)	GOLF ($7)	BOWLING ($6)	NEEDLEPOINT/EMBROIDERY ($6)	BRIDGE ($4)
11	SHORT-HAIRED BREED OF DOG	$96	DACHSHUND/DAKSHUND ($19)	BEAGLE ($15)	CHIHUAHUA ($14)	POODLE/* POODLE ($13)	TERRIER ($9)	BOXER ($9)	DOBERMAN[+PINSCHER] ($5)	GER+SHEP/SHEPhERD ($5)	BASSET[+HOUND] ($3)	BULLDOG ($2)	DALMATIAN ($2)
10	YOU SEE IN NEWSPAPERS	$97	ADS ($21)	HEADLINES ($19)	COMICS/CARTOON/FUNNIES ($16)	SPORTS ($15)	EDITORIALS ($10)	WEATHER ($5)	NEWS ($4)	FRONT+PAGE ($3)	OBITUARIES ($2)	TITLE/MASTHEAD ($2)
12	STATE THAT YOU RARELY HEAR ABOUT	$79	RHODE+ISL[AND]/RI ($34)	MAINE/ME ($9)	NORTH+DAKOTA/ND ($7)	IOWA/IA ($5)	NEW+HAMP[SHIRE]/NH ($5)	IDAHO/ID ($4)	NEW+MEXICO/NM ($4)	OREGON/OR ($3)	ARKANSAS/AR ($2)	CALIFORNIA/CA ($2)	DELAWARE/DE ($2)	HAWAII/HI ($2)
3	COMMON COLOR FOR SWEATSHIRTS	$95	GR(A/E)Y ($51)	BLUE ($31)	WHITE ($13)
3	NAME ONE OF THE THREE BEARS	$100	MAMA/MOMMA ($41)	PAPA/POPPA ($35)	BABY ($24)
9	FOOD THAT SPOILS EASILY	$96	MILK ($33)	MEAT ($27)	FISH ($9)	FRUIT ($8)	CREAM ($5)	POTATO SALAD ($5)	BREAD ($3)	CHEESE ($3)	MAYONNAISE ($3)
4	YOU CAN DO TO KEEP YOUR HEART IN GOOD SHAPE	$92	RUN/JOG ($42)	EXERCISE ($39)	EAT+RIGHT/(WATCH/LOSE)+WEIGHT ($7)	DON[']T+SMOKE/STOP+SMOKING ($4)
7	PUPPIES ARE IN A LITTER	$99	6 ($34)	5 ($27)	4 ($12)	8 ($10)	7 ($8)	3 ($5)	10 ($3)
7	THAT HAS HORNS	$91	BULL/COW ($52)	GOAT ($16)	CARS ($9)	ANTELOPE ($4)	DEER ($4)	DEVIL ($3)	ELK ($3)
9	TIMES A DAY DO YOU GET KISSED	$99	2 ($23)	3 ($22)	5 ($15)	10 ($13)	1 ($11)	0 ($5)	4 ($4)	6 ($3)	20 ($3)
8	FOUND IN HAWAII	$88	PINEAPPLEs ($32)	L(EI/AY)S ($19)	FLOWERs/OR(K/CH)IDs ($13)	SURFERs ($6)	BEACH[ES] ($5)	HULA+GIRLs ($5)	PALM+TREEs ($5)	GRASS+SKIRTs ($3)
7	NIGHTS A WEEK DO YOU STAY HOME AND WATCH TV	$98	5 ($30)	4 ($21)	3 ($17)	1 ($9)	2 ($9)	6 ($9)	0 ($3)
9	FISH IN THE OCEAN	$88	SHARK ($38)	TUNA ($18)	FLOUNDER ($6)	SALMON ($6)	BASS ($5)	SWORDFISH ($5)	WHALE ($4)	BARRACUDA ($3)	HALIBUT ($3)
7	NUTRITIOUS BREAKFAST FOOD	$99	EGGS ($52)	JUICE/* JUICE ($23)	MILK ($8)	CEREAL ($7)	BACON ($3)	FRUIT ($3)	TOAST ($3)
6	TIMES A YEAR DO YOU GIVE A PARTY	$91	2 ($27)	3 ($27)	1 ($19)	4 ($9)	0 ($5)	5 ($4)
4	KIND OF JACKET	$60	STRAIGHT/STRAIT ($25)	SPORTS ($18)	WINDBREAKER ($9)	YELLOW ($8)
7	YOU WEAR WHEN YOU DRESS CASUALLY	$89	[BLUE+]JEANS/DUNGAREES ($51)	SNEAKERS/TENNIS+SHOES ($12)	SLACKS/PANTS ($8)	SWEATS ($5)	SWEATER ($5)	SHIRT ($4)	SHORTS ($4)
3	COLOR OF PARAKEETS	$97	GREEN ($50)	YELLOW ($28)	BLUE ($19)
4	FOUND AT THE NORTH POLE	$86	SNOW ($33)	ICE ($25)	SANTA[+CLAUS] ($21)	POLAR+BEARs ($7)
5	LANGUAGE YOU LEARN IN SCHOOL	$100	SPANISH ($48)	FRENCH ($26)	ENGLISH ($19)	LATIN ($4)	GERMAN ($3)
4	BEST TV NIGHT OF THE WEEK	$78	THU[RSDAY] ($42)	SUN[DAY] ($15)	FRI[DAY] ($11)	SAT[URDAY] ($10)
4	BESIDES *BEST REGARDS* NAME ANOTHER WAY TO CLOSE A LETTER	$92	SINCERELY ($46)	SINC[ERELY]+YOURS ($26)	YOURS+TRULY ($12)	LOVE ($8)
5	THAT'S HARD TO WASH OFF YOUR HANDS	$88	GREASE/OIL ($45)	PAINT ($18)	INK ($16)	SAP/PITCH ($5)	GLUE/PASTE/ADHESIVE ($4)
7	FOOD WITH A TERRIBLE ODOR	$88	CHEESE ($31)	FISH ($15)	CABBAGE ($12)	ONION ($12)	GARLIC ($7)	SAUERKRAUT ($6)	LIVER ($5)
6	PERFUME	$66	CHANEL ($40)	GEORGIO ($7)	OPIUM ($6)	ESTEE+LAUDER ($5)	OBSESSION ($4)	PASSION ($4)
6	COLD STATE BESIDES ALASKA	$85	MINNESOTA/MN ($29)	MONTANA/MT ($18)	MAINE/ME ($16)	N[ORTH]+DAKOTA/ND ($10)	MICHIGAN/MI ($7)	WASHINGTON/WA ($5)
6	FIRST PART OF YOUR BODY THAT YOU SOAP UP IN THE SHOWER	$92	ARMS ($32)	FACE ($18)	CHEST ($16)	HAIR/HEAD ($14)	HANDS ($7)	ARMPITS/UNDERARMS ($5)
5	PEOPLE DRINK WITH DINNER	$96	WINE ($47)	MILK ($21)	WATER ($13)	[ICED+]TEA ($8)	COFFEE ($7)
5	PEOPLE WEAR THAT'S WHITE	$91	UNDERWEAR ($40)	SHIRT/BLOUSE ($25)	SO(CKS/X) ($9)	WEDDING+[GOWN/DRESS] ($9)	UNIFORM ($8)
6	CANNED VEGETABLE	$98	CORN ($39)	BEANs ($26)	PEAs ($25)	SPINACH ($3)	TOMATO[ES] ($3)	CARROTs ($2)
5	SOLD AT BASEBALL GAMES	$95	HOT+DOGS/FRANKS ($48)	PEANUTS ($18)	BEER ($14)	POPCORN ($10)	SODA+POP/SODA/POP ($5)
5	BESIDES A CLASSROOM NAME A ROOM IN SCHOOLS	$85	GYM[NASIUM] ($25)	CAFETERIA/LUNCH+ROOM ($24)	BATHROOM ($13)	LIBRARY ($12)	AUDITORIUM ($11)
6	FOOD THAT YOU FRY	$98	CHICKEN ($34)	POTATOES ($21)	FISH ($16)	EGGS ($13)	HAMBURGER ($7)	BACON ($7)
5	GENTLE ANIMAL	$88	CAT ($34)	RABBIT ($22)	LAMB ($20)	DOG ($8)	HORSE ($4)
3	VOICE IN A BARBERSHOP QUARTET	$100	TENOR ($48)	BASS ($28)	BARITONE ($24)
4	YOU DRINK WHEN YOU DON'T FEEL WELL	$90	TEA ($27)	MEDICINE ($23)	SODA+POP/SODA/COKE/PEPSI/POP ($22)	JUICE/* JUICE ($18)
4	WHERE WOULD MOST WOMEN WANT TO SUBTRACT AN INCH	$100	WAIST ($49)	HIPS ($43)	BEHIND/REAR/BUTT[OCKS] ($4)	THIGHS ($4)
6	FOOD THAT SHOULD BE BOUGHT FRESH	$96	FISH/SEAFOOD ($26)	VEGETABLES ($20)	FRUIT ($16)	BREAD ($14)	MEAT ($12)	MILK ($8)
5	COMMON COLOR FOR FLOWERS	$97	RED ($48)	YELLOW ($31)	PINK ($10)	WHITE ($4)	BLUE ($4)
4	SPORT WITH THE HIGHEST-PAID ATHLETES	$97	FOOTBALL ($54)	BASEBALL ($23)	BASKETBALL ($17)	GOLF ($3)
5	INSURANCE COMPANY	$67	PRUDENTIAL ($22)	STATE+FARM ($17)	ALLSTATE ($16)	MUT[UAL]+[OF+]OMAHA ($6)	FARMERS ($6)
6	OCCUPATION YOU'D HATE YOUR NEIGHBOR TO HAVE	$61	MUSICIAN ($22)	GARBAGEMAN ($12)	POLICEMAN ($8)	MORTICIAN/FUNERAL+DIRECTOR ($7)	MECHANIC ($6)	TAX+COLLECTOR/IRS ($6)
5	COUNTRY WHERE AUTO-RACING IS A BIG SPORT	$97	USA/UNITED+STATES/AMERICA ($39)	FRANCE ($33)	ITALY ($19)	MONACO ($3)	ENGLAND/[GREAT+]BRITAIN/UK/UNITED+KINGDOM ($3)
5	YOU BUY BECAUSE IT'S WARM AND SNUGGLY	$83	BLANKET/COMFORTER ($37)	PET/DOG/CAT/PUPPY/KITTEN ($13)	COAT/JACKET ($13)	ROBE ($12)	SWEATER ($8)
6	MEMBER OF THE WEDDING PARTY	$95	BRIDE ($52)	GROOM ($19)	BEST+MAN ($13)	(MAID/MATRON)+[OF+]HONOR ($5)	BRIDESMAID ($3)	FLOWER+GIRL ($3)
5	DEVICE YOU LOOK THROUGH	$95	TELESCOPE ($48)	BINOCULARS ($25)	MICROSCOPE ($13)	MAGNIFIER/MAGNIFYING+GLASS ($5)	EYEGLASSES ($4)
5	SPORT THAT DOES NOT HAVE CHEERLEADERS	$85	BASEBALL ($34)	HOCKEY ($21)	TENNIS ($15)	GOLF ($8)	SOCCER ($7)
4	MONTH WHEN YOU SEE THE FIRST ROBIN	$98	APR[IL] ($39)	MAR[CH] ($37)	MAY ($17)	FEB[RUARY] ($5)
4	PEOPLE WEAR TWO OF AT THE SAME TIME	$98	SHOES ($47)	SO(CKS/X)/STOCKINGS/HOSE ($36)	EARRINGS ($11)	GLOVES/MITTENS ($4)
5	YOU PUT WHIPPED CREAM ON	$96	PIE/* PIE ($39)	CAKE/* CAKE ($20)	ICECREAM/* ICE+CREAM/SUNDAE ($16)	PUDDING/* PUDDING/JELL-O ($11)	STRAWBERRY ($10)
4	MONTH PEOPLE START WEARING SUMMER CLOTHES	$99	MAY ($55)	JUNe ($24)	APR[IL] ($18)	JULy ($2)
5	APPLIANCE YOU TRY TO FIX YOURSELF WHEN IT BREAKS DOWN	$78	TOASTER ($49)	VACUUM ($10)	WASHER/WASHING+MACHINE ($10)	BLENDER/MIXER ($5)	CAN+OPENER ($4)
7	COMMON FIRST NAME FOR A WOMAN	$75	MARY ($43)	ANN ($7)	LINDA ($6)	SUSAN ($6)	JANE ($5)	BETTY ($4)	DEBBIE ($4)
7	YOU BUY IN A CELLOPHANE BAG	$75	CHIPS ($23)	BREAD ($17)	CANDY ($10)	COOKIES ($8)	PASTA/NOODLES/MACARONI/SPAGHETTI ($7)	CARROTS ($5)	POTATOES ($5)
5	IN A LADY'S PURSE	$73	LIPSTICK ($42)	COMPACT ($10)	MONEY ($8)	WALLET ($7)	MIRROR ($6)
4	YOU TASTE FOR A LONG TIME AFTER EATING IT	$80	ONIONS ($37)	GARLIC ($30)	CUCUMBERS ($7)	CHILI ($6)
5	ANIMAL THAT PERFORMS	$92	DOG ($47)	ELEPHANT ($16)	SEAL ($15)	BEAR ($7)	MONKEY ($7)
6	A GARDENER DOES	$97	WEED ($36)	MOW+LAWN/CUT+GRASS ($18)	[PLANT+]FLOWERS ($17)	HOES/DIGS ($12)	TRIMS/PRUNES ($7)	WATERS ($7)
5	COURSE IN A FULL-COURSE MEAL	$100	ENTREE ($28)	SALAD ($24)	DESSERT ($20)	SOUP ($16)	APPETIZER ($12)
5	WE GET FROM THE SUN	$95	SUNTAN/SUNBURN ($35)	HEAT/WARMTH ($33)	LIGHT ($12)	ENERGY ($9)	VITAMINS ($6)
4	POPULAR COLOR FOR SOCKS	$99	WHITE ($44)	BLACK ($37)	BLUE ($13)	BROWN ($5)
4	A DOG DOES TO TELL YOU HOW HE FEELS	$90	WAGS+[HIS+/ITS+]TAIL ($37)	BARKS ($25)	WHINES ($19)	LICKS ($9)
5	YOU'D SEE IN AN AIRPLANE	$75	STEWARDESS/ATTENDANTS/CREW ($41)	SEATS ($13)	(NO+SMOKING/SEAT+BELT)+SIGN ($8)	PILOT ($7)	PASSENGERS ($6)
4	STATE WITH *NEW* IN ITS NAME	$100	NEW+YORK/NY ($46)	NEW+HAMP[SHIRE] ($25)	NEW+MEXICO ($18)	NEW+JERSEY ($11)
5	ROOM IN YOUR HOUSE THAT IS MOST IN NEED OF REDECORATING	$97	KITCHEN ($27)	LIVING+ROOM ($22)	BEDROOM ($21)	BATHROOM ($18)	DEN/FAMILY+ROOM ($9)
4	MONTH WHEN YOU RECEIVE YOUR TAX REFUND	$95	APR[IL] ($27)	MAR[CH] ($24)	MAY ($24)	JUNe ($20)
4	CARS HAVE TWO OF	$89	HEADLIGHTS ($46)	DOORS ($26)	[WINDSHIELD+]WIPERS ($9)	SEATS ($8)
5	AIRLINE	$88	UNITED ($34)	AMERICAN ($22)	TWA/TRANS+WORLD ($15)	DELTA ($11)	PAN+AN ($6)
5	MOST COMMON FOOD AT A PICNIC	$95	[FRIED+]CHICKEN ($37)	POT[ATO]+SALAD ($22)	HOT+DOGS/FRANK[FURTER]S ($17)	SANDWICH ($11)	[HAM]BURGERS ($8)
4	FRUIT YOU EAT WITH BREAKFAST	$95	BANANAS ($37)	GRAPEFRUIT ($36)	ORANGES ($11)	STRAWBERRY ($11)
6	FOUND IN A JUNGLE	$95	LIONS ($25)	MONKEYS/APES ($24)	TIGERS ($19)	SNAKES ($12)	TREES ($8)	VINES ($7)
5	FABRIC EVENING GOWNS ARE MADE OF	$95	SILK ($42)	SATIN ($34)	TAFFETA ($10)	CHIFFON ($7)	VELVET ($2)
4	PLACE WHERE PEOPLE EAT PEANUTS	$94	[BASE]BALL+PARK/STADIUM ($47)	CIRCUS ($25)	ZOO ($16)	BAR ($6)
3	MOST USEFUL SCHOOL SUBJECT	$95	MATH/ARITHMETIC ($42)	ENGLISH ($33)	READING ($20)
3	FRUIT THAT SQUIRTS	$93	ORANGE ($41)	GRAPEFRUIT ($30)	LEMONS ($22)
6	THAT GOES WELL WITH A FRANKFURTER	$90	MUSTARD ($35)	BEANS ($18)	SAUERKRAUT ($16)	BUN ($9)	[FRENCH+]FRIES/CHIPS ($6)	(KETCH/CATS)UP ($6)
4	CREAM PIE	$93	BANANA ($34)	CHOCOLATE ($21)	COCONUT ($20)	BOSTON ($18)
4	MONTH WHEN YOU START LOOKING FORWARD TO SPRING	$95	FEB[RUARY] ($34)	JAN[UARY] ($27)	MAR[CH] ($26)	APR[IL] ($8)
5	KIND OF BREAD	$84	RYE ($37)	[WHOLE+]WHEAT ($29)	FRENCH ($10)	WHITE ($4)	SOURDOUGH ($4)
4	MONTH OF THE FOOTBALL SEASON	$87	NOV[EMBER] ($37)	OCT[OBER] ($22)	DEC[EMBER] ($15)	SEP[TEMBER] ($13)
3	WATER-SKIERS WEAR	$95	SKIS ($44)	LIFE+(JACKET/PRESERVER) ($30)	SWIMSUIT/BATHING+SUIT ($21)
5	WHAT ARTICLE OF CLOTHING DO WOMEN SAY THEY OWN THE MOST OF	$93	BLOUSES/SHIRTS ($45)	PANTS/JEANS/SLACKS ($27)	UNDERWEAR/LINGERIE ($11)	SHOES ($5)	DRESSES ($5)
6	LETTER MANY WORDS BEGIN WITH	$90	S ($44)	T ($26)	M ($6)	A ($6)	B ($5)	R ($3)
6	PEOPLE DO WHEN THE SUN GOES DOWN	$82	[TURN]+LIGHTS+ON/TURN+ON+LIGHTS ($29)	SLEEP ($21)	WATCH+(TV/TELEVISION) ($13)	GO+(INDOORS/INSIDE) ($8)	EAT+(DINNER/SUPPER) ($6)	[GO+TO+]MOVIES ($5)
4	YOU DO TO YOUR FINGERNAILS	$93	FILE ($33)	POLISH/PAINT ($30)	BITE ($16)	CUT/TRIM/CLIP ($14)
3	BOOK THAT IS IN JUST ABOUT EVERY HOUSEHOLD	$94	BIBLE/* BIBLE ($42)	COOKBOOK ($37)	DICTIONARY ($15)
4	PART OF A CHICKEN	$96	LEG ($40)	BREAST ($27)	WING ($23)	THIGH ($6)
4	GREEN VEGETABLE	$70	PEAS ($30)	[GREEN+/STRING+]BEANS ($22)	SPINACH ($12)	BROCCOLI ($6)
4	ANIMAL THAT CAN KILL A MAN	$97	LION ($46)	BEAR ($34)	TIGER ($10)	SHARK ($7)
5	YOU CARVE	$98	TURKEY ($52)	WOOD ($25)	CHOCOLATE/SWEETS ($10)	ROAST/* ROAST/MEAT ($7)	PUMPKIN ($4)
5	YOU DO WHILE DRIVING	$92	(PLAY+/LISTEN+TO+)RADIO ($36)	SING ($35)	TALK ($8)	EAT ($7)	SMOKE ($6)
5	PEOPLE DO ON VACATION	$75	SWIM ($22)	SIGHTSEE ($18)	RELAX ($15)	SUNBATHE ($13)	TAKE+[PHOTOS/PICTURES] ($7)
4	YOU CLIMB	$92	MOUNTAIN/HILL ($35)	TREE ($24)	STAIRS/STEPS ($19)	LADDER ($14)
5	BESIDES APPLES NAME ANY FRUIT	$82	ORANGE ($37)	BANANA ($19)	PEACH ($13)	PEAR ($8)	PLUM ($5)
5	MONTH OF THE BASEBALL SEASON	$91	JUNe ($28)	MAY ($19)	JULy ($19)	APR[IL] ($18)	OCT[OBER] ($7)
4	BESIDES A BIRTHDAY CARD NAME A KIND OF GREETING CARD	$83	(CHRIST/X+)MAS ($41)	ANNIVERSARY ($23)	GET+WELL ($14)	SYMPATHY/CONDOLENCE ($5)
5	INDIAN TRIBE	$88	SIOUX/SUE ($27)	NAVAJO ($25)	CHEROKEE ($15)	APACHE ($13)	BLACKFOOT ($8)
3	THAT CLIMBS A TREE	$94	CAT ($36)	MONKEY ($32)	SQUIRREL ($26)
6	UGLY BIRD	$76	VULTURE ($32)	OSTRICH ($24)	PELICAN ($7)	CROW ($5)	EMU ($4)	[SEA+]GULL ($4)
2	SPORT IN WHICH GLOVES ARE WORN	$82	BOXING ($47)	BASEBALL/SOFTBALL ($35)
3	DESSERT ON ALMOST EVERY RESTAURANT MENU	$98	PIE ($46)	ICE+CREAM ($40)	CAKE ($12)
4	NAME ANY KIND OF CHAIR	$88	ROCKER/ROCKING+CHAIR ($46)	EASY[+CHAIR] ($30)	LOUNGE ($8)	HIGH[+CHAIR] ($4)
3	FOOD YOU EAT BY THE HANDFUL	$96	POPCORN ($45)	NUTS ($44)	[POTATO+]CHIPS ($7)
6	EXPENSIVE HOBBY	$60	SAILING/BOATING ($13)	FLYING ($11)	SKIING ($12)	COINS ($10)	GOLF ($7)	[CLASSIC+]CARS ($7)
12	FOOD THAT KEEPS A LONG TIME	$69	CHEESE ($18)	EGGS ($10)	PICKLES ($7)	PEANUT+BTR/PEANUT+BUTTER ($5)	SUGAR ($5)	BUTTER ($4)	CARROTS ($4)	RICE ($4)	BEANS ($3)	CEREAL ($3)	FLOUR ($3)	JAM/JELLY ($3)
9	ON A SCALE OF 1 TO 10 HOW MUCH DID YOU LIKE SCHOOL	$97	5 ($18)	8 ($18)	10 ($17)	7 ($16)	9 ($10)	6 ($7)	1 ($4)	3 ($4)	2 ($3)
3	SUNNIEST MONTH	$98	JULy ($56)	AUG[UST] ($33)	JUNe ($9)
9	A FORGETFUL PERSON MIGHT GO TO WORK WITHOUT	$94	BRIEFCASE/ATTACHE[+CASE] ($32)	LUNCH ($32)	WALLET/BILLFOLD ($11)	KEYS ($5)	PURSE/POCKETBOOK/HANDBAG ($4)	GLASSES ($3)	WATCH ($3)	HANKY/HANDKERCHIEF ($2)	MONEY ($2)
2	PART OF THE BODY YOU BRUSH	$98	HAIR/HEAD ($61)	TEETH ($37)
3	FAMOUS CANAL	$100	PANAMA ($58)	ERIE ($21)	SUEZ ($21)
12	SPORTS CAR	$91	PORSCHE ($21)	[COR]VET[TE] ($18)	JAGUAR ($15)	TRIUMPH ($8)	MG ($7)	FERRARI ($6)	FIAT ($5)	DATSUN/NISSAN ($3)	CAMARO ($2)	FIREBIRD ($2)	MASERATI ($2)	MERCEDES ($2)
3	THAT'S GOOD FOR YOUR LAWN	$97	FERTILIZER/MANURE ($53)	WATER/RAIN ($42)	MULCH ($2)
11	YOU BUY BY THE SET	$90	DISHES/CHINA ($35)	[GOLF+]CLUBS ($10)	SILVERWARE/FLATWARE ($10)	SALT+PEPPER[+SHAKERS] ($8)	TV[+SET]/TELEVISION ($8)	GLASSES/(SUN/EYE)GLASSES ($7)	EARrINGS ($3)	SHOES ($3)	PENS/PENCILS ($2)	TIRES ($2)	WED[DING]+(RINGS/BANDS) ($2)
11	YOU FIND AT THE BOTTOM OF A DESK DRAWER	$91	PAPER+CLIPS ($36)	PENCILS/PEN ($16)	PAPER ($9)	MONEY/COINS ($8)	RUBBER+BANDS ($7)	DIRT ($3)	LETTERS ($3)	[UNPAID+]BILLS ($3)	LINT ($2)	PICTURES/PHOTOS ($2)	RULER ($2)
4	COMMON COLOR FOR BATH TOWELS	$92	BLUE ($46)	WHITE ($27)	BROWN ($12)	YELLOW ($7)
3	WHO WAS THE FIRST PERSON YOU TOLD WHEN YOU BECAME ENGAGED	$93	PARENTS/MOTHER/FATHER ($57)	[BEST+]FRIEND ($28)	SISTER ($8)
6	TROPICAL FRUIT	$95	PINEAPPLE ($48)	KIWI ($15)	PAPAYA ($13)	BANANA ($8)	MANGO ($6)	COCONUT ($5)
5	FOUND IN A HOSPITAL	$74	BEDS ($28)	NURSES ($14)	DOCTORS/PHYSICIANS ($13)	BEDPANS ($11)	NEEDLES ($8)
5	WORD IN WEATHER REPORTS	$74	SUNNY ($22)	RAIN ($21)	FAIR ($11)	CLOUDY ($11)	TEMPERATURE ($9)
5	CUT OF STEAK YOU ORDER IN A RESTAURANT	$98	T+BONE ($23)	FILET[+MIGNON] ($21)	RIB[+STEAK] ($20)	NEW+YORK[ STRIP][ STEAK] ($19)	SIRLOIN ($15)
3	PART OF A CAR OPERATED BY YOUR FOOT	$99	GAS[+PEDAL]/ACCELERATOR ($47)	BRAKE ($45)	CLUTCH ($7)
4	COLDEST ROOM IN YOUR HOUSE	$85	BEDROOMS ($44)	BATHROOM ($29)	BASEMENT ($7)	LIVING[+ROOM] ($5)
4	THAT MIGHT BE CUSTOM BUILT LOWER IN A SHORT PERSON'S HOUSE	$88	CABINETS ($38)	COUNTERS ($23)	SINK ($21)	TOILET ($6)
5	ANIMAL WITH PAWS	$98	DOG ($37)	CAT ($35)	BEAR ($14)	LION ($6)	TIGER ($6)
3	MUSICAL INSTRUMENT WHICH NEEDS FREQUENT TUNING	$98	GUITAR ($38)	PIANO ($36)	VIOLIN ($24)
4	PART OF A SHIRT	$92	COLLAR ($50)	SLEEVE ($31)	POCKET ($7)	CUFF ($4)
4	POPULAR COLOR FOR WALLPAPER	$86	BLUE ($41)	BEIGE/TAN ($23)	YELLOW ($14)	WHITE ($8)
6	WITH NUMBERS ON IT	$64	CLOCK ($21)	TELEPHONE ($20)	LIC[ENSE]+PLATE ($8)	CALENDAR ($6)	CALCULATOR ($5)	WATCH ($4)
4	MONTH YOU START CHRISTMAS SHOPPING	$94	NOV[EMBER] ($39)	OCT[OBER] ($36)	SEP[TEMBER] ($11)	DEC[EMBER] ($8)
4	UGLY CITY	$58	NEW+YORK/NYc ($20)	CHICAGO ($18)	PITTSBURGH ($11)	DETROIT ($9)
