8	FOUND IN HEALTH CLUBS	$88	WEIGHTS/BARBELLS ($41)	EXERCISE+BIKES/BICYCLES/EXERCYCLES ($13)	JACUZZI ($10)	SAUNA ($10)	[SWIMMING+]POOL ($5)	SCALES ($4)	FAT+PEOPLE/OVERWEIGHT ($3)	SHOWERS ($2)
6	WORD FOR *GOOD-BYE* IN A LANGUAGE OTHER THAN ENGLISH	$97	ADIOS ($58)	ALOHA ($11)	AU+REVOIR/AREVUAR ($10)	CIAO ($8)	SAYONARA ($7)	ARRIVEDERCI ($3)
5	COUNTRY FAMOUS FOR SPICY FOOD	$98	MEXICO ($68)	ITALY ($17)	INDIA ($8)	THAILAND ($3)	SPAIN ($2)
5	ACTOR PAST OR PRESENT FAMOUS FOR HIS *HORROR MOVIES*	$94	[V[INCENT]+]PRICE ($46)	[B[ELA]+]LUGOSI ($19)	[B[ORIS]+]KARLOFF ($18)	[L[ON]+]CHANEY ($9)	[F[REDDY]+]KREUGER ($2)
5	PLACE PEOPLE GO WHEN THEY'RE TROUBLED	$93	CHURCH/CLERGYMAN/MINISTER/PRIEST ($64)	DOCTOR/PSYCHIATRIST/PHYSICIAN/SHRINK ($14)	BAR ($6)	FRIENDS ($6)	PARENTS ($3)
5	YOU DO TO A TURKEY	$97	STUFF[+IT] ($53)	COOK[+IT] ($15)	EAT[+IT] ($11)	BASTE[+IT] ($10)	CARVE[+IT] ($8)
4	FAMOUS CAT	$97	MORRIS ($52)	GARFIELD ($28)	FELIX ($13)	FRITZ ($4)
6	MOST IMPORTANT PERSON IN THE HISTORY OF AMERICA	$91	[G[EORGE]+]WASHINGTON ($37)	[A[B(E/RAHAM)]+]LINCOLN ($25)	[C[HRISTOPHER]+]COLUMBUS ($14)	[T[HOMAS]+]EDISON ($5)	[B[ENJAMIN]+]FRANKLIN ($5)	[T[HOMAS]+]JEFFERSON ($5)
6	YOU PUT IN YOUR EAR	$89	Q+TIP/[COTTON+]SWAB ($37)	EAR+RING ($12)	EAR+DROPS ($11)	EAR+PLUGS ($10)	HEARING+AID ($10)	(HEAD/EAR)+PHONES ($9)
4	LITTLE GIRLS PUT ON WHEN THEY PLAY *GROWN-UP*	$100	MAKE+UP ($54)	[HIGH+]HEELS ($37)	[MOM[']S+](HAT/CLOTHES) ($8)	WIG ($1)
5	PRINCESS	$96	DIANA ($70)	GRACE ($12)	ANNE ($7)	CAROLINE ($4)	MARGARET ($3)
8	FAMOUS BEARDED MAN REAL OR FICTIONAL	$89	[A[B(E/RAHAM)]+]LINCOLN ($55)	SANTA[+CLAUS] ($15)	BLUEBEARD ($7)	JESUS[+CHRIST] ($4)	[S[IGMUND]+]FREUD ($2)	[O[RSON]+]WELLES ($2)	[U[LYSSES][+S]/GEN[ERAL]]+GRANT ($2)	[R[AYMOND]+]BURR ($2)
5	THAT MAKES A MAN LOOK DISTINGUISHED	$96	GR(A/E)Y+HAIR ($37)	[HIS+]CLOTHES ($30)	MOUSTACHE/MUSTACHE ($19)	BEARD ($7)	PIPE ($3)
6	MALE STAR WHO HAS THE WORST *TEMPERAMENT* OFF SCREEN	$77	[S[EAN]+]PENN ($56)	[B[RUCE]+]WILLIS ($5)	[F[RANK]+]SINATRA ($5)	[S[(YLVESTER/LY)]+]STALLONE ($5)	[B[URT]+]REYNOLDS ($3)	[R[YAN]+]O[']NEAL ($3)
5	OCCUPATION WHOSE MEMBERS PLAY GOLF DURING BUSINESS HOURS	$98	PHYSICIANS/DOCTORS/MEDICINE ($74)	LAWYERS/ATTORNEY ($12)	BANKERS ($6)	CONGRESSMEN/POLITICIANS ($3)	SALESMEN ($3)
4	EUROPEAN COUNTRY AMERICANS VISIT	$96	FRANCE ($53)	ENGLAND ($30)	ITALY ($7)	GERMANY ($6)
4	HOW DO NEW PARENTS PICK A NAME FOR THEIR BABY	$95	RELATIVE[']S ($52)	BOOK ($37)	AFTER+(SELF/THEMSELVES) ($4)	FAMOUS ($2)
6	ARTICLE SOMEONE MIGHT WEAR EVEN AT A NUDIST COLONY	$90	[EYE]GLASSES ($23)	RING ($21)	WATCH ($17)	SHOES ($15)	HAT ($10)	EARRINGS ($4)
6	SWITZERLAND IS FAMOUS FOR	$95	ALPS ($39)	SKIING ($20)	CHOCOLATE ($13)	WATCHES/CLOCKS ($10)	CHEESE ($9)	BANKS ($4)
7	YOU ARE SURE TO TURN OFF BEFORE YOU LEAVE THE HOUSE FOR THE DAY	$97	STOVE/OVEN ($43)	COFFEE+POT ($19)	IRON ($17)	HEATER ($8)	CURLING+IRON/CURLER/ROLLERS ($4)	LIGHTS ($3)	TV[+SET]/TELEVISION ($3)
4	WHY DO PEOPLE EAT IN FAST-FOOD RESTAURANTS	$95	[[TO+]SAVE+]TIME/CONVENIENCE ($67)	CHEAP/INEXPENSIVE ($14)	[NO+]COOKING ($10)	TASTE ($4)
3	YOU BUY BY THE ROLL	$80	TOILET+PAP[ER]/TOILET+TISSUE ($57)	PAPER+TOWEL ($17)	FILM ($6)
6	OCCUPATION THAT REQUIRES A STEADY HAND	$92	SURGEON/PHYSICIAN ($64)	DIAMOND+CUT[TER] ($10)	ARTIST ($8)	DENTIST ($4)	HOUSE+PAINT/PAINTER ($3)	WELDER ($3)
7	BESIDES FOOD THAT YOU MIGHT FIND IN A PICNIC BASKET	$95	NAPKINS ($31)	PLATES ($27)	SILVERWARE/UTENSILS ($13)	TABLECLOTH ($9)	ANTS ($8)	WINE ($4)	BLANKET ($3)
4	YOU DO WHILE SOAKING IN THE TUB	$88	READ ($50)	RELAX/SLEEP ($27)	SING ($8)	SHAVE ($3)
7	THAT HAPPENS AT EVERY WEDDING	$91	KISS+[THE+]BRIDE ($40)	CRYING ($21)	(TOSS/THROW)+(BOUQUET/FLOWERS) ($9)	THROW+RICE ($7)	CUT+[THE+]CAKE ($5)	(SAY/EXCHANGE)+VOWS ($5)	(GIVE/EXCHANGE)+RINGs ($4)
5	A WOMAN TRIES TO GUESS ABOUT A MAN BEFORE A BLIND DATE	$96	[HIS+]LOOKS ($64)	[HIS+]HEIGHT ($19)	[HIS+]AGE ($7)	[HIS+]PERSONALITY ($4)	KIND+OF+CAR/[* ][OF+]CAR ($2)
4	PLACE WHERE YOU'D HATE TO BE SEATED NEAR A SCREAMING BABY	$96	THEATER/MOVIES ($46)	CHURCH ($26)	RESTAURANT ($18)	[AIR]PLANE ($6)
6	BESIDES THE BERING SEA NAME ANOTHER SEA	$91	RED ($35)	MEDIT('/ERRANEA)N ($17)	DEAD ($13)	BALTIC ($9)	CARIBBEAN ($9)	BLACK ($8)
5	YOU PUT ON A PIZZA	$93	CHEESE ($59)	PEPPERONI ($22)	MUSHROOMS ($5)	SAUSAGE ($4)	TOMATO ($3)
4	FAMOUS CIGAR SMOKER	$96	[G[EORGE]+]BURNS ($85)	GROUCHO[+MARX] ($5)	[W[INSTON]+]CHURCHILL ($4)	[W+C+]FIELDS ($2)
3	PEOPLE DONATE TO THE SALVATION ARMY	$98	CLOTHES ($89)	FURNITURE ($5)	MONEY ($4)
8	THAT CREAKS	$93	DOOR ($35)	FLOOR ($14)	STAIRS/STEPS ($13)	BED ($8)	SHOES ($8)	ROCK(ER/ING+CHAIR) ($7)	BONES ($6)	HOUSE ($2)
8	POSITION ON A BASEBALL TEAM	$95	PITCHER ($47)	SHORTSTOP ($14)	CATCHER ($12)	FIRST BASE ($10)	(LEFT+/RIGHT+/OUT)FIELD ($4)	CENTERFIELD ($3)	THIRD+BASE ($3)	SECOND+BASE ($2)
11	HOURS PER DAY DO BABIES SLEEP	$98	12 ($21)	18 ($20)	16 ($12)	15 ($10)	20 ($9)	14 ($7)	6 ($5)	4 ($4)	8 ($4)	10 ($4)	3 ($2)
4	NAME SOMEONE CONNECTED WITH THE CIVIL WAR	$96	[U[LYSSES][+S]/GEN[ERAL]]+GRANT ($38)	[A[B(E/RAHAM)]+]LINCOLN ($32)	[R[[OBERT]+E]+]LEE ($23)	[W[ILLIAM]/GEN[ERAL]]+SHERMAN ($3)
5	BEST TEENAGE YEAR	$99	16 ($46)	18 ($30)	17 ($18)	19 ($3)	15 ($2)
6	CREAMED VEGETABLE	$95	CORN ($53)	PEAs ($19)	CARROTs ($8)	SPINACH ($8)	POTATO[ES] ($5)	ONIONs ($2)
9	HOW OLD WERE YOU THE FIRST TIME YOU SUFFERED A *BROKEN HEART*	$96	16 ($31)	14 ($13)	13 ($12)	15 ($12)	12 ($9)	18 ($8)	17 ($5)	10 ($4)	9 ($2)
6	SPORT WHOSE REFEREES MAKE THE MOST MISTAKES	$99	FOOTBALL ($34)	BASKETBALL ($29)	BASEBALL ($27)	HOCKEY ($5)	BOXING ($2)	WRESTLING ($2)
6	INSECT THAT DISAPPEARS IN WINTER	$97	FLY ($38)	MOSQUITO ($31)	ANT ($14)	BEE ($9)	MOTH ($3)	SPIDER ($2)
6	IDEAL INDOOR TEMPERATURE IN DEGREES	$96	70 ($43)	72 ($28)	68 ($10)	65 ($6)	75 ($6)	78 ($3)
5	THAT *TIES YOU DOWN*	$89	CHILDREN/KIDS/BABIES ($60)	JOB/WORK ($12)	MARRIAGE/SPOUSE/MATE ($7)	PETS ($7)	SWEETHEART/(BOY/GIRL)FRIEND ($3)
5	NAME SOMEONE CONNECTED WITH THE AMERICAN REVOLUTION	$95	[G[EORGE]+]WASHINGTON ($62)	[P[AUL]+]REVERE ($26)	[P[AUL]+]HENRY ($3)	[B[ENNEDICT]+]ARNOLD ($2)	[T[HOMAS]+]JEFFERSON ($2)
4	BESIDES CAPE HATTERAS NAME A WELL-KNOWN CAPE	$98	[CAPE+]COD ($78)	[CAPE+](CANAVERAL/KENNEDY) ($11)	[CAPE+]HORN ($6)	[CAPE+[OF+]]GOOD+HOPE ($3)
3	THAT MOVES VERY SLOWLY	$90	TURTLE/TORTOISE ($50)	SNAIL ($35)	WORM ($5)
7	YOU EAT BY THE SLICE	$93	BREAD ($36)	PIZZA ($28)	CAKE ($9)	PIE ($6)	CHEESE ($5)	ORANGE ($5)	COLD+CUTS/LUNCH+MEAT ($4)
10	NAME SOME FAMOUS BROTHERS REAL OR FICTIONAL	$91	SMOTHERS ($38)	MARX ($16)	WRI[GH]T ($13)	SMITH ($7)	GRIMM ($5)	BLUES ($4)	JAMES ($2)	KENNEDY ($2)	RINGLING ($2)	STATLER ($2)
4	THAT VAMPIRES HATE	$96	DAYLIGHT ($53)	CROSS[ES] ($25)	GARLIC ($14)	WOOD+STAKEs ($4)
5	THAT OFTEN GETS A HOLE IN IT	$91	SO(CKs/X) ($56)	PANTYHOSE/NYLONs/STOCKINGs ($19)	PANTS/POCKETs ($10)	DO[UGH]NUTs ($3)	SHIRTs ($3)
7	FAMOUS AMERICAN INDIAN REAL OR FICTIONAL	$94	SIT('G/TING)+BULL ($41)	GERONIMO ($20)	COCHISE ($12)	POCAHONTAS ($10)	JIM+THORPE ($4)	TONTO ($4)	CRAZY+HORSE ($3)
4	WHAT EUROPEAN CITY WOULD YOU MOST LIKE TO VISIT	$86	PARIS ($48)	LONDON ($25)	ROME ($10)	VENICE ($3)
7	FOOD RECOGNIZABLE BY ITS ODOR	$87	ONIONS ($32)	FISH ($23)	GARLIC ($11)	PIZZA ($8)	CABBAGE ($6)	POPCORN ($4)	CHEESE ($3)
4	DOCUMENT THAT IDENTIFIES YOU IN SOME WAY	$96	DR[IVERs]+LICENSE ($55)	BIRTH+CERTIFICATE ($33)	PASSPORT ($4)	SOCIAL+SEC[URITY][+CARD] ($4)
3	YOU BEAT	$95	DRUM ($49)	EGGS ($33)	RUGS/CARPET ($13)
7	BODY PART THAT WOMEN SPEND THE MOST TIME FRETTING OVER	$100	FACE/MOUTH/EYES ($51)	HAIR ($17)	BUST/BREASTS ($10)	HIPS ($8)	STOMACH/WAIST/TUMMY/BELLY ($8)	REAR/BEHIND/BUTT ($4)	THIGH ($2)
4	FAMOUS JACKSON	$94	MICHAEL ($59)	ANDREW ($18)	JESSE ($15)	JANET ($2)
5	PEOPLE USE TO KEEP BURGLARS AWAY	$100	DOG/* DOG ($43)	ALARM ($38)	LIGHTS ($10)	LOCKS ($5)	GUNS ($4)
4	PEOPLE BET MONEY ON	$100	HORSE[S/+RACEs]/RACES ($83)	DOG[S/+RACEs] ($7)	BALL+GAMES/FOOTBALL ($7)	CARDS ($3)
8	REAL OR FICTIONAL MAN KNOWN AS A FAMOUS LOVER	$82	VALENTINO ($29)	CASANOVA ($13)	DON+JUAN ($11)	[C[LARK]+]GABLE ($10)	[E[RROL]+]FLYNN ($6)	ROMEO ($6)	[B[URT]+]REYNOLDS ($4)	[R[OB[ERT]]+]REDFORD ($3)
5	PEOPLE DO WITH THEIR HANDS WHEN THEY'RE COLD	$98	(RUB/WRING)+THEM ($62)	[PUT+IN+]POCKETS ($16)	BLOW+ON[+THEM] ($9)	WEAR+(GLOVE/MITTEN)S ($7)	SIT+ON+THEM ($4)
7	GOOD TO EAT THAT COMES IN A SHELL	$95	NUTS ($30)	CLAMS ($20)	LOBSTER ($15)	OYSTERS ($10)	CRAB ($9)	SHRIMP ($7)	TACO ($4)
4	OCCUPATION IN WHICH A MAN USES HIS GOOD LOOKS	$96	MODELING ($51)	ACTING ($29)	SALESMAN ($14)	GIGOLO ($2)
5	GAME PEOPLE PLAY IN THEIR BACKYARD	$87	CROQUET ($35)	BADMINTON ($25)	VOLLEYBALL ($13)	HORSESHOES ($8)	PING+PONG/TABLE+TENNIS ($6)
7	PEOPLE STICK PINS IN	$97	PIN+CUSHION ($74)	MATERIAL/CLOTHES/FABRIC ($10)	BULL[ETIN]+BOARD ($4)	MAP ($3)	CORK ($2)	DIAPER ($2)	VOODOO+DOLLs ($2)
5	WHY DOES A WOMAN WHO HAS RESISTED MARRIAGE FINALLY AGREE	$94	[[TO+]HAVE+](KIDS/CHILDREN) ($34)	AG(E/ING)/[GETTING+]OLDER ($17)	LONELINESS/ALONE ($16)	LOVE ($15)	MONEY ($12)
6	WHO IS THE MOST ADMIRED ATHLETE OF ALL TIME	$81	[BABE+]RUTH ($50)	[JIM+]THORPE ($10)	[JESSE+]OWENS ($7)	[BRUCE+]JENNER ($5)	[ROGER+]STAUBACH ($5)	[JOE+]LOUIS ($4)
3	BAD HABIT PEOPLE WOULD LIKE TO BREAK	$99	SMOKING ($81)	[FINGER]NAIL+BITING/BITING+[FINGER]NAILS ($16)	SWEARING/CURSING ($2)
7	YOU LICK	$100	ICE+CREAM/POPSICLE/CONE ($38)	CANDY ($32)	STAMPS ($20)	ENVELOPE ($3)	LIPS ($3)	FINGERS ($2)	SPOON ($2)
5	WHAT COUNTRY IS THE WORLD'S WORST TROUBLE-MAKER	$97	IRAN ($53)	RUSSIA/USSR/SOVIET+UNION ($26)	LIBYA ($12)	ISRAEL ($3)	LEBANON ($3)
5	THAT THE FAMILY TAKES TURNS USING	$93	BATHROOM ($68)	CAR/AUTO* ($13)	[HAIR/BLOW]+DRYER ($6)	[TELE]PHONE ($4)	TV[+SET]/TELEVISION ($2)
4	EXCUSE PEOPLE GIVE FOR BEING LATE	$92	TRAFFIC ($44)	OVER+SLEPT ($32)	CAR+TROUBLE ($13)	[PHONE+]CALL ($3)
5	WHAT DO YOU THINK IS AMERICA'S MOST POPULAR FOOD	$95	[HAM]BURGERs ($58)	PIZZAs ($28)	HOT+DOGs/FRANK[FURTER]s ($5)	CHICKEN ($2)	PASTA/SPAGHETTI ($2)
4	OCCASION WHEN PEOPLE PUT UP SPECIAL DECORATIONS	$96	(CHRIST/X+)MAS ($80)	BIRTHDAY ($10)	EASTER ($3)	HALLOWEEN ($3)
3	GIFT WOMEN LOVE THE MOST FROM MEN	$99	JEWELRY ($55)	FLOWERS ($42)	MONEY ($2)
5	THAT PEOPLE CHEAT ON	$100	[INCOME+]TAX[ES] ($67)	TEST/EXAM ($16)	DIET ($8)	SPOUSE/SWEETHEART/MATE/WIFE/HUSBAND ($7)	CARDS ($2)
6	WORST PRESIDENT IN US HISTORY	$86	[RICHARD+]NIXON ($33)	[JIMMY+]CARTER ($27)	[(U[LYSSES][+S]/GEN[ERAL])+]GRANT ($7)	[RONALD+]REAGAN ($7)	[WARREN+]HARDING ($6)	[HERBERT+]HOOVER ($6)
7	THAT MEN DO BEFORE GOING ON A DATE	$94	SHAVE ($39)	BATHE/SHOWER ($25)	[PUT+ON+](COLOGNE/AFTERSHAVE) ($12)	BRUSH+TEETH ($7)	COMB+HAIR ($7)	(COUNT/GET/CHECK)+MONEY ($2)	[BREATH+]MINT ($2)
4	THAT PEOPLE SAVE	$89	MONEY ($72)	PHOTO[GRAPH]S/PICTURES ($7)	COUPONS ($5)	STAMPS ($5)
3	IMPORTANT ONCE-A-YEAR SPORTS EVENT	$94	SUPER+BOWL ($60)	WORLD+SERIES ($30)	ROSE+BOWL ($4)
5	JOB IN WHICH PEOPLE MAKE MORE MONEY THAN THEY DESERVE	$82	LAWYER/ATTORNEY ($27)	ATHLETE ($25)	ACTOR ($10)	PHYSICIAN/DOCTOR ($10)	POLITICIAN ($10)
6	FAMOUS RUSSIAN	$91	GORBACHEV ($27)	STALIN ($23)	BARYSHNIKOV ($21)	LENIN ($11)	KhRUShCHEV ($5)	TOLSTOY ($4)
6	YOU CAN DO TO STAY AWAKE WHILE DRIVING	$96	SING ($37)	[OPEN/ROLL+DOWN]+WINDOW ($20)	[PLAY/TURN+ON]+RADIO ($19)	[DRINK+]COFFEE ($13)	EAT/CHEW+GUM ($5)	TALK ($2)
6	IF YOU'RE SHORT OF MONEY WHAT'S THE ONE BILL YOU'RE SURE TO PAY	$97	RENT/MORtGAGE ($63)	ELECTRIC/UTILITY ($20)	[TELE]PHONE ($6)	GAS/HEAT ($4)	(CAR/AUTO)+INSURANCE ($2)	(CAR/AUTO)+(PAYMENT/LOAN) ($2)
3	TYPE OF CAMPBELL'S SOUP	$96	CHICKEN ($44)	TOMATO ($38)	VEGETABLE ($14)
11	COUNTRY YOU'D BE MOST INTERESTED IN LEARNING ABOUT	$88	ENGLAND/GREAT+BRITAIN/UNITED+KINGDOM/UK ($16)	FRANCE ($15)	CHINA ($11)	GERMANY ($10)	USA/AMERICA/UNITED+STATES ($9)	RUSSIA/USSR/SOVIET+UNION ($6)	AUSTRALIA ($6)	CANADA ($5)	JAPAN ($4)	MEXICO ($4)	IRELAND ($2)
2	DRINK MADE WITH ICE CREAM	$100	FLOAT/SODA ($59)	MILKSHAKE/MALT ($41)
3	ROOM YOU PUT A TV IN	$99	DEN/FAMILY/STUDY ($59)	LIVING+ROOM ($35)	BED+ROOM ($5)
9	A HUSBAND ASKS HIS WIFE TO CARRY IN HER PURSE	$92	KEYS ($21)	CIGARETTES ($14)	GLASSES/[EYE/SUN]+GLASSES ($14)	WALLET ($13)	CHECKBOOK ($10)	COMB ($8)	PILLS/MEDICINE ($8)	TISSUES/KLEENEX ($2)	MONEY ($2)
9	USED TO KEEP OUT THE SUN	$97	[SUN]GLASSES ($31)	UMBRELLA ($22)	W(ND/INDO)W+SHADE ($19)	VISOR ($7)	HAT ($6)	SUN(TAN+LOTION/SCREEN)/BLOCK ($5)	BLINDS/VENETIANS/VERTICALS ($3)	DRAPES ($2)	TREE ($2)
3	YOU SERVE WITH CAKE	$98	ICE+CREAM ($54)	COFFEE ($32)	MILK ($12)
6	DAY OF THE WEEK WHEN YOUR GARBAGE GETS COLLECTED	$100	MON[DAY] ($28)	WED[NESDAY] ($26)	TUE[SDAY] ($23)	FRI[DAY] ($12)	THU[RSDAY] ($9)	SAT[URDAY] ($2)
2	BAD HABIT THAT MIGHT ALSO BE A NERVOUS HABIT	$95	[FINGER]NAIL+BITING/BITING+[FINGER]NAILS ($49)	SMOKING/CIGARETTES ($46)
12	LAMPS DO YOU HAVE IN YOUR HOME	$95	6 ($20)	5 ($18)	10 ($15)	4 ($11)	8 ($7)	3 ($5)	7 ($4)	9 ($4)	2 ($3)	12 ($3)	15 ($3)	11 ($2)
4	THAT MAKES GETTING DIVORCED HARDER THAN GETTING MARRIED	$94	SETTLEMENTS/ALIMONY/SUPPORT/PAYMENTS ($43)	CHILDREN/KIDS/[CHILD+]CUSTODY ($31)	LEGAL+FEES/LAWYER/ATTORNEY/COST ($16)	LIVING+ALONE/LONELY ($4)
7	THAT SOME PEOPLE LIKE TO DO ALONE AND SOME PEOPLE DON'T	$68	GO+OUT ($14)	EAT/DINE ($11)	WATCH+T(V/ELEVISION) ($11)	DRINK ($10)	SLEEP ($9)	STUDY ($7)	WORK ($6)
5	WAY A MOTHER CAN TELL JUST BY LOOKING THAT HER CHILD IS SICK	$97	COLORING/PALE/RED/FLUSHED ($39)	EYES ($27)	LOOKS+TIRED ($16)	RUNNY+NOSE ($11)	NOT+EATING/APPETITE ($4)
5	YOU DO WHEN YOU CALL INTO WORK SICK BUT YOU'RE FINE	$72	GO+SHOPPING ($42)	PLAY+GOLF ($9)	CLEAN+HOUSE ($8)	SLEEP ($8)	GO+TO+BEACH ($5)
5	HOTELS OFFER TO ENTICE CUSTOMERS	$76	POOL ($29)	FREE+T(V/ELEVISION) ($24)	WATER+BEDs ($12)	LOW+RATEs ($6)	BREAKFAST/MEALS/FOOD ($5)
3	EXPENSE THAT'S GREATER WITH DAUGHTERS THAN WITH SONS	$95	WEDDINGS/MARRIAGE ($47)	CLOTHES ($44)	COSMETICS/MAKE-UP ($4)
4	QUESTION YOU MIGHT ANSWER WITH A LIE OTHER THAN YOUR AGE	$84	[YOUR+]WEIGHT ($61)	INCOME/MONEY/SALARY ($12)	HAIR+COLOR/NATURAL ($6)	MAR(RIED/ITAL+STATUS) ($5)
8	EVERY DOCTOR HAS	$91	STETHOSCOPE ($48)	NURSE ($12)	PATIENTS ($9)	LICENSE ($6)	DEGREE ($5)	THERMOMETER ($5)	BED[SIDE]+MANNER ($3)	INSURANCE ($3)
5	NAME SOMEONE WHO HAS TO LISTEN TO PROBLEMS ALL DAY LONG	$87	CLERGYMAN/PRIEST/MINISTER/RABBI ($59)	COUNSELOR/SOCIAL WORKER ($10)	BAR(TENDER/MAID) ($10)	LAWYER/ATTORNEY ($4)	JUDGE ($4)
5	FAMOUS FAIRY	$97	TINKERBELL ($46)	TOOTH+FAIRY ($18)	[FAIRY+]GODMOTHER ($15)	PETER+PAN ($14)	GOOD+FAIRY ($4)
6	KIDS DO OTHER THAN STUDY WHEN THEY'RE IN SCHOOL	$91	DAYDREAM ($24)	SLEEP ($18)	MISBEHAVE/UNRULY/*+TROUBLE ($13)	DRAW/DOODLE ($12)	TALK ($12)	PLAY+HOOKY/DITCH/CUT+CLASS ($12)
6	YOU DO TO CHEER SOMEONE UP	$90	TELL+JOKES ($34)	[SEND+](FLOWERs/GIFT) ($25)	TALK/TELEPHONE/CALL ($12)	[SEND+][A+]CARD ($9)	VISIT ($6)	TAKE OUT ($4)
6	YOU HATED TO DO WHEN YOU WERE A CHILD BUT WISH YOU COULD DO NOW	$84	NAP/SLEEP ($36)	[GO+TO+]SCHOOL ($24)	MUSIC+LESSONs/* LESSONs ($17)	EAT ($3)	SAVE MONEY ($2)	TRAVEL ($2)
7	BOYS GENERALLY START DOING AT A YOUNGER AGE THAN GIRLS	$70	SMOKING ($16)	DRIV(E/ING)[+CAR] ($15)	DATING ($12)	STAY[ING]+OUT[+LATE] ($8)	WORK[ING] ($7)	DRINKING ($6)	SPORTS/ATHLETICS ($6)
3	THAT IS MORE DIFFICULT FOR A WOMAN TO DO THAN FOR A MAN	$79	LIFT/CARRY ($44)	(FIX/REPAIR)+CAR ($29)	GET+[A+]JOB ($6)
5	WHAT IS THE MOST IMPORTANT QUALITY A SCHOOL TEACHER SHOULD HAVE	$83	PATIENCE ($61)	PERSONALITY ($9)	LOVE ($5)	DEDICATION ($4)	FAIRNESS ($4)
3	NAME ONE OF THE HEMINGWAYS	$97	ERNEST/PAPA ($80)	MARGAUX ($13)	MARIEL ($4)
3	IF YOU WORKED A FOUR-DAY WEEK WHICH WEEKDAY WOULD YOU LIKE OFF	$99	FRI[DAY] ($60)	MON[DAY] ($31)	WED[NESDAY] ($8)
4	A DOOR-TO-DOOR SALESPERSON SELLS	$82	BRUSHES ($32)	VACUUMS/VACUUM+CLEANERS ($22)	MAGAZINES ($17)	COSMETICS/MAKE+UP ($11)
4	THAT COMES IN BUNCHES	$82	FLOWERS ($25)	BANANAS ($24)	CARROTS ($17)	GRAPES ($16)
5	THAT MOST YOUNG PEOPLE HOPE THE FUTURE HOLDS FOR THEM	$94	MONEY/SUCCESS/WEALTH/FORTUNE ($62)	HAPPINESS ($16)	GOOD+HEALTH/LONG+LIFE ($9)	MARRIAGE/FAMILY ($4)	FAME ($3)
3	THAT TENANTS CALL THE LANDLORD TO FIX	$99	PLUMBING/FAUCETS/PIPES/SINK/TOILET ($91)	HEATER/FURNACE/BURNER ($4)	LEAKY+ROOF ($4)
3	THAT KIDS PLAY WITH IN THE BATHTUB	$97	[RUBBER+]DUCK ($55)	[TOY+]BOAT ($38)	SOAP ($4)
3	THAT MAKES A PERSON A BAD TENANT	$87	NOISY/LOUD ($55)	LATE[+WITH]+RENT ($27)	SLOPPY/MESSY/DIRTY ($5)
6	MANY AMERICANS ARE APATHETIC ABOUT	$77	POLITICS/VOTING ($47)	HUNGER/STARVING+PEOPLE/STARVATION ($8)	WORLD+(NEWS/EVENTS)/INTERNATIONAL/EVENTS ($7)	INFLATION/TAXES ($6)	ENERGY ($5)	LITTER[ING]/POLLUTION ($4)
6	PEOPLE SAY *YOU CAN'T FIGHT CITY HALL* BUT HOW COULD YOU TRY	$89	PETITIONS ($33)	PICKET/PROTEST/MARCH ($32)	WRITE/LETTERS ($11)	GET+A+LAWYER/ATTORNEY ($5)	PAY+NO+TAX ($4)	POLITICS/RUN+FOR+OFFICE ($4)
8	THAT'S EASY FOR CHILDREN TO LEARN BUT HARD FOR ADULTS	$84	SKATE ($20)	LANGUAGE/FOREIGN[ LANGUAGE] ($18)	RIDE+(BI(KE/CYCLE)) ($17)	SWIM ($12)	READ ($7)	PLAY PIANO/PLAY * ($4)	SKI ($4)	DANCE ($2)
5	THAT DRIVES MEN TO AN EARLIER GRAVE THAN WOMEN	$91	WORK/JOB/CAREER/PROFESSION ($44)	WOMEN/MARRIAGE ($22)	STRESS/WORRY ($14)	DRINKING/ALCOHOL ($9)	SMOKING/CIGARETTE ($2)
3	FRUIT THAT'S GOOD ON BREAKFAST CEREAL	$99	BANANAS ($82)	STRAWBERRY ($14)	PEACHES ($3)
5	REASON PEOPLE QUIT SCHOOL	$94	WORK/JOB ($42)	NO+INTEREST/BORED ($18)	TOO+HARD/FAILING/GRADES/DIFFICULT ($13)	PREGNANCY ($12)	GET+MARRIED/MARRIAGE ($9)
5	JOB OLD BALL PLAYERS GET WHEN THEIR PLAYING DAYS ARE OVER	$97	(BROAD/SPORTS)CASTER/RADIO/TV/TELEVISION ($45)	COACHING/MANAGER ($35)	ACTOR/COMMERCIALS/ADVERTISING ($12)	SALES ($3)	OWN+[A+]RESTAURANT ($2)
6	MANY PARENTS POSTPONE DOING UNTIL THE KIDS ARE GROWN	$97	TRAVELLING/TRIP/VACATION/HOLIDAY ($81)	DIVORCE ($5)	MOVING ($4)	DECORATING ($3)	NEW+CAR ($2)	SAVING ($2)
3	DAY OF THE YEAR WHEN IT'S HARD TO CALL LONG DISTANCE	$99	(CHRIST/X+)MAS ($75)	MOTHER[']S+DAY ($19)	NEW+YEAR[']S ($5)
3	YOU GIVE THANKS FOR WHEN SAYING GRACE	$97	FOOD ($81)	HEALTH ($12)	FAMILY ($4)
4	THAT BOTHERS YOU WHEN YOU'RE SLEEPING IN AN UNFAMILIAR ROOM	$87	BED/MATTRESS ($41)	NOISES/SOUND ($33)	PILLOWS ($7)	CLOCK ($6)
8	A WIFE DOES THAT MAKES HER HUSBAND NERVOUS	$85	DRIVES[[+THE]+CAR] ($32)	SPENDS+MONEY/SHOPS ($19)	NAGS/COMPLAINS ($12)	TALKS ($9)	LATE ($4)	CRIES ($3)	FLIRTS ($3)	PREGNANT ($3)
4	TEENAGERS CAN DO FOR HOURS	$90	TALK[[+ON]+PHONE] ($58)	LISTENMUSIC/[* ](MUSIC/RADIO/RECORD/TAPE/CD) ($17)	DANCE/PARTY ($11)	WATCH+(TV/TELEVISION) ($4)
6	BESIDES A BATHING SUIT THAT PEOPLE WEAR TO SWIM	$97	BATHING+CAP ($34)	SHORTS ($32)	NOTHING ($13)	DIVING+GEAR/WETSUIT/SCUBA ($12)	LIFE+[JACKET/VEST] ($3)	NOSE+PLUG ($3)
3	WORK YOU MIGHT NOT BECOME FAMOUS IN UNTIL AFTER YOU'RE DEAD	$92	ARTIST/PAINTER ($71)	WRITER/AUTHOR ($18)	SCIENTIST/INVENTOR ($3)
6	EXPENSE THAT'S MORE FOR PARENTS WITH SONS THAN DAUGHTERS	$95	[BUY/PURCHASE+]CAR ($28)	EDUCATION/SCHOOL/COLLEGE ($22)	INSURANCE ($20)	SPORTS ($16)	FOOD ($5)	DATING ($4)
6	PEOPLE DO WHEN THEY'VE LOST THEIR DOG	$99	ADVERTISE ($42)	CALL+(POUND/SHELTER) ($14)	CRY ($14)	LOOK+FOR/SEARCH ($14)	[OFFER+]REWARD ($9)	CALL+[THE+]POLICE ($6)
7	PEOPLE WOULD LIKE TO RIDE IN	$88	SPACE+(SHIP/SHUTTLE) ($31)	LIMOUSINE/LUXURY+CAR ($26)	BLIMP/DIRIGIBLE ($9)	HELICOPTER ($8)	BALLOON ($6)	CRUISE+SHIP ($5)	RACE(+CAR/R) ($3)
5	WOMEN SPEND MORE ON THAN MEN	$93	COSMETICS/MAKE+UP ($69)	UNDERWEAR/LINGERIE ($9)	HAIRDRESSER/BEAUTY+(SALON/PARLOR) ($6)	CLOTHES ($6)	JEWELRY ($3)
6	ACTIVITY THAT USED TO BE HELD ON COLLEGE CAMPUSES	$80	PANTY+RAIDS ($33)	SIT+INS/DEMONSTRATIONS ($20)	HAZING/INITIATIONS ($10)	SWALLOW[ING]+FISH/GOLDFISH ($9)	PEP+RALLIES ($4)	STREAKING ($4)
4	PEOPLE SHOULD FORCE THEMSELVES TO DO MORE OFTEN	$78	EXERCISE ($55)	[GO+][TO+]CHURCH ($12)	DIET ($7)	SEE+(DOCTOR/PHYSICIAN) ($4)
4	STATE WHERE COTTON IS GROWN	$86	ALABAMA/AL ($37)	GEORGIA/GA ($30)	MISSISSIPPI/MS ($11)	LOUISIANA/LA ($8)
3	MEAT USED IN SANDWICHES	$77	HAM ($41)	BOLOGNA/BALONEY ($22)	ROAST+BEEF ($14)
4	NAME YOUR MOST COMFORTABLE ROOM	$100	BEDROOM ($36)	LIVING+ROOM ($32)	DEN/FAMILY+ROOM ($19)	KITCHEN ($13)
4	THAT TASTES SWEET	$85	CANDY ($49)	SUGAR ($22)	CHOCOLATE ($9)	HONEY ($5)
4	KIDS PUT OFF DOING	$98	HOMEWORK ($43)	CHORES/JOBS ($42)	WASHING/BATH ($7)	GOING[+TO]+BED ($6)
4	FIREMEN DO	$78	CLIMB+LAD[DERS] ($39)	FIGHT+FIRES/PUT+OUT+FIRES ($26)	FIRST+AID ($8)	SAVE+PEOPLE ($5)
4	ARTICLE OF SKI CLOTHING	$70	JACKET/PARKA ($22)	BOOTS ($21)	SWEATER ($16)	GLOVES ($11)
3	YOU PUT IN TEA	$92	SUGAR ($50)	LEMON ($35)	MILK ($7)
4	PLACE YOU HEAR VERY LOUD MUSIC	$90	DISCO[THEQUE] ($48)	CONCERT ($31)	BAR ($6)	NIGHT+CLUB/CLUB ($5)
4	YOU POLISH	$82	CAR ($34)	SHOES ($23)	FURNITURE ($17)	SILVER ($8)
4	FOOD SERVED AT COOKOUTS	$87	[HAM]BURGERS ($36)	HOT+DOGS/FRANK[FURTER]S ($32)	POT[ATO]+SALAD ($11)	BEANS ($8)
4	A PORTRAIT PAINTER USES	$93	BRUSH ($49)	EASEL ($18)	PAINT ($18)	CANVAS ($8)
4	YOU DRINK IN THE MORNING	$94	COFFEE ($39)	JUICE ($36)	MILK ($15)	TEA ($4)
3	SPORT THAT'S FUN TO PLAY BUT BORING TO WATCH	$68	GOLF ($28)	TENNIS ($25)	BASEBALL ($15)
7	LITTLE BOYS COLLECT	$84	MARBLES ($23)	B[ASE]BALL+CARDS ($19)	BUGS ($11)	ROCKS ($11)	FROGS ($10)	CARS ($5)	STAMPS ($5)
4	MONTH WHEN YOU MAIL IN YOUR INCOME TAX RETURN	$100	FEB[RUARY] ($34)	APR[IL] ($33)	MAR[CH] ($22)	JAN[UARY] ($11)
6	MONTH WHEN YOU START SHOPPING FOR SUMMER CLOTHES	$99	APR[IL] ($34)	MAR[CH] ($26)	MAY ($26)	FEB[RUARY] ($6)	JUNe ($5)	JAN[UARY] ($2)
10	EXPENSIVE BREED OF DOG	$80	POODLE/* POODLE ($23)	AFGHAN ($12)	GREAT+DANE ($7)	GR(E/A)YHOUND ($7)	S[AIN]T+BERNARD ($7)	DOBERMAN[+PINSCHER] ($6)	HUSKY ($5)	YORK(Y/SHIRE+TERRIER) ($5)	LABRADOR[+RETRIEVER] ($4)	LHASA+APSO ($4)
9	AT WHAT AGE DOES A WOMAN START TO LOOK LIKE AN *OLDER WOMAN*	$83	40 ($22)	45 ($13)	50 ($12)	35 ($11)	30 ($7)	55 ($7)	60 ($5)	25 ($3)	65 ($3)
8	NAME YOUR LEAST FAVORITE MONTH	$93	JAN[UARY] ($37)	FEB[RUARY] ($20)	SEP[TEMBER] ($11)	MAR[CH] ($7)	APR[IL] ($6)	AUG[UST] ($6)	JULy ($3)	NOV[EMBER] ($3)
8	HOURS ARE THERE IN A HOUSEWIFE'S WORKDAY	$86	12 ($24)	16 ($20)	24 ($15)	15 ($10)	18 ($7)	9 ($4)	4 ($3)	10 ($3)
2	THAT HAS YOUR BIRTH DATE ON IT	$100	[DRIVER[']S+]LICENSE ($67)	BIRTH+CERTIFICATE ($33)
5	AFTER HOW MANY YEARS OF MARRIAGE SHOULD A COUPLE HAVE A CHILD	$96	2 ($41)	3 ($28)	1 ($16)	5 ($9)	4 ($2)
7	WHAT'S THE MOST DAYS YOU'VE EVER GONE WITHOUT BATHING	$98	2 ($38)	3 ($29)	7 ($14)	1 ($6)	6 ($5)	4 ($3)	5 ($3)
12	HOW MUCH IN DOLLARS DOES THE AVERAGE FAMILY SPEND A WEEK ON FOOD	$95	50 ($27)	100 ($16)	60 ($11)	75 ($10)	70 ($7)	80 ($7)	150 ($4)	30 ($3)	125 ($3)	200 ($3)	35 ($2)	45 ($2)
8	HOURS EACH DAY DO YOU WATCH TV	$96	4 ($33)	5 ($18)	3 ($17)	2 ($10)	6 ($7)	8 ($5)	1 ($4)	10 ($2)
8	DAYS IS *TOO LONG* FOR A HOUSEGUEST TO VISIT	$95	7 ($36)	14 ($33)	30 ($7)	3 ($6)	21 ($4)	4 ($3)	8 ($3)	10 ($3)
3	THAT HAS A SHARP EDGE	$94	KNIFE ($55)	RAZOR ($37)	SAW ($2)
3	EXPENSIVE FLOWER	$97	ROSE ($50)	OR(CH/K)ID ($45)	CARNATION ($2)
4	PART OF A TREE	$100	TRUNK ($52)	BRANCH ($22)	LEAVES ($17)	BARK ($9)
3	BRAND OF TUNA	$100	STAR+KIST ($57)	CHICKEN[+OF]+SEA ($38)	BUMBLE+BEE ($5)
4	PLACE KIDS ARE TOLD TO BEHAVE	$96	CHURCH ($54)	SCHOOL ($26)	RESTAURANT ($11)	[SUPER+]MARKET/[GROCERY+]STORE/GROCERY ($5)
3	GOOD PET FOR AN APARTMENT	$91	BIRD ($37)	FISH ($35)	CAT ($19)
3	YOU DO THAT GIVES YOU A BACKACHE	$52	LIFTING ($31)	GARDENING/YARD+WORK ($12)	SHOVELING ($9)
5	PART OF THE FACE	$99	NOSE ($63)	EYES ($18)	MOUTH/LIP ($9)	CHEEK ($7)	FOREHEAD ($2)
4	SIZE OF BED	$100	KING ($59)	QUEEN ($21)	TWIN ($11)	DOUBLE/FULL ($9)
4	SPORT THAT TAKES PLACE IN THE AIR	$99	SKYDIVING ($58)	GLIDING ($30)	FLYING ($9)	KITE+FLYING ($2)
12	BORING PET	$79	FISH ($16)	SNAKE ($14)	TURTLE ($12)	BIRD ($9)	CAT ($5)	GOPHER ($4)	PIG ($4)	SNAIL ($4)	WORM ($4)	ANTEATER ($3)	BEAR ($2)	MOLE ($2)
3	NAME ONE OF COLUMBUS' SHIPS	$100	NINA ($47)	SANTA+MARIA ($36)	PINTA ($17)
3	INSTRUMENT IN COUNTRY MUSIC	$97	GUITAR ($53)	BANJO ($29)	FIDDLE/VIOLIN ($15)
3	SPORT PLAYED ON A FIELD	$100	FOOTBALL ($66)	BASEBALL ($21)	SOCCER ($13)
10	MOVING VAN COMPANY	$88	ALLIED ($24)	MAYFLOWER ($19)	GLOBAL ($13)	U+HAUL ($13)	ATLAS ($4)	BEKINS ($4)	UNITED ($4)	AMERICAN ($3)	RED+BALL ($2)	WORLDWIDE ($2)
3	ANIMAL THAT RESEMBLES A HORSE	$99	DONKEY/MULE/ASS ($52)	ZEBRA ($45)	DOG ($2)
7	FAMILIES DO IN THE CAR ON LONG TRIPS	$96	SING ($34)	SLEEP ($21)	PLAY[+GAMES] ($15)	ARGUE/YELL/FIGHT ($14)	TALK ($6)	EAT ($4)	READ ($2)
6	TIMES PER YEAR DO PEOPLE GET SICK	$94	2 ($39)	3 ($24)	1 ($12)	4 ($8)	5 ($8)	0 ($3)
7	HOW MUCH IN DOLLARS DOES A LARGE PIZZA COST	$69	10 ($24)	8 ($15)	15 ($9)	9 ($7)	5 ($6)	6 ($5)	4 ($3)
7	TIMES PER YEAR DO YOU GO TO THE MOVIES	$74	3 ($14)	6 ($13)	10 ($13)	5 ($11)	12 ($11)	2 ($6)	15 ($6)
3	A WOMAN MIGHT RECEIVE FROM AN *ANONYMOUS ADMIRER*	$97	FLOWERS ($53)	LETTER/NOTE ($27)	CARD/VALENTINE ($17)
3	MOST LUXURIOUS METHOD OF TRAVEL	$100	[AIR]PLANE ($48)	SHIP/BOAT/YACHT/YAT ($46)	LUXURY+CAR/LIMOUSINE ($6)
6	FEATHERS ARE USED FOR	$94	PILLOWS ($50)	HATS ($20)	DUSTERS ($11)	TICKLING ($7)	FLOWER+ARR[ANGEMENTS] ($3)	HEADDRESS ($3)
8	MINUTES DOES IT TAKE TO DO A CROSSWORD PUZZLE	$90	60 ($33)	30 ($25)	120 ($10)	20 ($5)	45 ($5)	15 ($4)	180 ($4)	100 ($4)
4	AGE WHEN A MAN IS *OVER THE HILL*	$58	60 ($18)	65 ($14)	50 ($13)	70 ($13)
5	JUNK FOOD	$95	POTATO+CHIP ($45)	CANDY ($19)	TWINKIES ($13)	FRIES/FRENCH+FRIES ($9)	PIZZA ($9)
3	MONTH YOU DO YOUR *SPRING CLEANING*	$96	APR[IL] ($48)	MAR[CH] ($28)	MAY ($20)
7	NAME THE ANIMAL YOU WOULD LIKE TO BE REINCARNATED AS	$95	DOG ($29)	CAT ($20)	BIRD/PARROT ($16)	HORSE ($16)	LION ($8)	BEAR ($3)	DEER ($3)
12	STATE WHERE YOU'D LEAST LIKE TO LIVE	$80	ALASKA/AK ($33)	NEW+YORK/NY ($10)	CALIFORNIA/CA ($7)	NEW+JERSEY/NJ ($7)	GEORGIA/GA ($4)	MAINE/ME ($3)	MISSISSIPPI/MS ($3)	MONTANA/MT ($3)	OKLAHOMA/OK ($3)	TEXAS/TX ($3)	FLORIDA/FL ($2)	ILLINOIS/IL ($2)
4	HOLIDAY WHEN YOU DRESS UP	$97	EASTER ($45)	HALLOWEEN ($26)	(CHRIST/X+)MAS ($19)	NEW+YEAR[']S ($7)
12	MUSICAL INSTRUMENT WITH A *HAUNTING* SOUND	$90	ORGAN ($19)	OBOE ($17)	VIOLIN ($14)	FLUTE ($12)	HARP ($9)	CELLO ($5)	BAGPIPES ($3)	TUBA ($3)	BASSOON/BASOON ($2)	BUGLE ($2)	PIANO ($2)	SAXOPHONE ($2)
12	HOW MUCH IS YOUR WEEKLY GROCERY BILL IN DOLLARS	$91	100 ($18)	50 ($17)	75 ($13)	60 ($10)	40 ($6)	70 ($6)	80 ($6)	30 ($4)	65 ($4)	20 ($3)	45 ($2)	55 ($2)
7	FOOD BACHELORS MAKE	$96	TV+DINNERS ($36)	SANDWICHES ($26)	STEAK ($18)	SPAGHETTI/MACARONI/PASTA ($9)	SOUP ($3)	CANNED+FOOD ($2)	PIZZA ($2)
8	WRAPPED IN CELLOPHANE	$91	CANDY/SWEETS ($29)	MEAT ($20)	CIGARETTES ($11)	CHEESE ($9)	BREAD ($8)	FRUIT ($6)	LETTUCE ($6)	SANDWICH ($2)
4	MEAL	$99	DINNER ($51)	BREAKFAST ($36)	SUPPER ($7)	LUNCH ($5)
