5	ON WHICH PEOPLE ACCIDENTALLY BUMP THEIR HEADS	$92	DOORs ($48)	CABINETs/CUPBOARDs ($33)	LIGHTs ($5)	WALLs ($4)	[CAR+]TRUNK ($2)
6	PEOPLE MISTAKE FOR UFO'S	$94	SATELLITE/[WEATHER+]BALLOON ($32)	[AIR]PLANE/HELICOPTER ($27)	METEOR/STAR ($21)	COMET ($7)	LIGHTS ($5)	CLOUDS ($2)
4	THAT PEOPLE SAY THEY'RE *AS HAPPY AS*	$88	[A+]LARK ($75)	CAN+BE ($5)	[A+]CLAM ($5)	[A+]CLOWN ($3)
6	PEOPLE *BLOW OUT*	$97	[BIRTHDAY+]CANDLES ($46)	TIRES ($41)	AIR ($3)	MATCHES ($3)	FUSES ($2)	[THEIR+]NOSEs ($2)
5	CAREER FOR A GOOD LIAR	$93	SALESMAN ($49)	POLITICIAN ($31)	LAWYER/ATTORNEY ($8)	ACTOR ($3)	POLICE*/DETECTIVE/SPY/AGENT/COP ($2)
11	VEGETABLE YOU MARINATE	$96	BEANs/* BEANs ($15)	CUCUMBERs/PICKLEs ($15)	CARROTs ($12)	MUSHROOMs ($10)	ARTICHOKEs ($9)	ONIONs ($8)	POTATO[ES] ($8)	TOMATO[ES] ($8)	CAULIFLOWER ($7)	BEETs ($2)	BROCCOLI ($2)
4	COUNTRY KNOWN FOR ITS BEAUTIFUL WOMEN	$91	SWEDEN ($38)	FRANCE ($25)	USA/UNITED+STATES/AMERICA ($24)	ITALY ($4)
4	BESIDES HATS THAT PEOPLE HANG ON A HAT STAND	$99	COATs/JACKETs ($56)	UMBRELLAs ($33)	SCAR(F/VES) ($8)	TIEs ($2)
5	OCCUPATION WHOSE MEMBERS ARE OFTEN PHOTOGRAPHED	$92	MODELING ($58)	ACT(ING/ORS) ($14)	POLITIC[IAN]S ($12)	SPORTS/ATHLET(IC/E)S ($5)	POLICE[MEN] ($3)
4	FOOD SOME PEOPLE LIKE WITH OR WITHOUT SUGAR	$90	CEREAL ($45)	COFFEE ($24)	GRAPEFRUIT ($17)	[ICED+]TEA ($4)
6	SPOOKY SOUND	$90	CREAK*/SQUEAK* ($51)	BOO ($17)	WIND/* WIND ($10)	OWL+HOOT/HOOooo ($5)	SCREAM/YELL ($4)	HOWL[ING] ($3)
5	THAT INSECURE PEOPLE ARE INSECURE ABOUT	$78	APPEARANCE/LOOKS ($38)	JOB/* JOB/WORK ($19)	MONEY ($13)	LOVE ($4)	MARRIAGE ($4)
8	THAT KIDS HAVE A FAVORITE ONE OF	$87	TOY/STUFFED+ANIMAL/DOLL/TEDDY*+BEAR ($37)	TV+(SHOW/PROGRAM)/TELEVISION ($17)	FOOD/DESSERT ($13)	BLANKET ($7)	FRIEND ($4)	RELATIVE/AUNT/UNCLE/GRAND(+PARENT/MA/PA) ($3)	COLOR ($3)	TEACHER ($3)
4	SOUND THAT CAN LULL YOU TO SLEEP	$83	MUSIC/RADIO ($53)	RAIN ($14)	OCEAN/SURF/WAVES ($10)	CLOCK/TICK ($6)
8	FOUND ON A GOLF COURSE	$92	GRASS/GREENs ($27)	TEEs ($18)	HOLEs ($13)	SAND+TRAPs ($13)	GOLF+BALLs ($7)	FLAGs ($6)	[GOLF+]CARTs ($5)	GOLFERs ($3)
8	AGE MEN START GOING GRAY	$92	40 ($36)	45 ($15)	35 ($14)	50 ($12)	55 ($6)	30 ($5)	48 ($2)	52 ($2)
7	YOU BUY PICKLED	$100	BEETs ($38)	PIGs+FEET ($23)	HERRINGs ($17)	CUCUMBERs/PICKLEs ($13)	EGGs ($4)	ONIONs ($3)	CAULIFLOWERs ($2)
7	KITCHEN APPLIANCE	$95	STOVE/MICROWAVE/RANGE/OVEN ($41)	TOASTER ($23)	MIXER/BLENDER ($11)	CAN+OPENER ($7)	FRIDGE/REFRIGERATOR/ICEBOX ($6)	DISHWASHER ($4)	COFFEEPOT ($3)
6	STATE WHICH HAS AVALANCHES	$97	COLORADO/CO ($49)	CALIFORNIA/CA ($22)	ALASKA/AK ($16)	UTAH/UT ($4)	WASHINGTON/WA ($4)	WYOMING/WY ($2)
12	APPROXIMATELY HOW MUCH DOES A NEW TV SET COST	$94	500 ($31)	600 ($21)	400 ($14)	450 ($6)	300 ($4)	700 ($4)	350 ($3)	800 ($3)	200 ($2)	395 ($2)	650 ($2)	750 ($2)
10	PEOPLE SWING	$92	BATs/BASEBALL ($27)	SWINGs/PEOPLE ($16)	ARMs ($15)	[GOLF+]CLUBs ($15)	AXEs ($4)	HIPs ($4)	(PURSE/BAG/POCKET+BOOK)s ($4)	KEYs ($3)	LEGs ($2)	ROPEs ($2)
12	AGE IN YEARS WHEN GIRLS LEARN TO DANCE	$100	12 ($37)	13 ($16)	10 ($14)	14 ($7)	8 ($6)	15 ($6)	5 ($3)	6 ($3)	7 ($2)	9 ($2)	11 ($2)	16 ($2)
6	FOREIGN HAT	$100	BERET ($35)	SOMBRERO/MEXICAN ($29)	TURBAN ($21)	DERBY ($9)	FEZ ($4)	PANAMA ($2)
6	TYPE OF MUFFIN	$97	BLUEBERRY ($43)	ENGLISH ($23)	BRAN ($17)	CORN ($9)	EGG+MCMUFFIN ($3)	BLACKBERRY ($2)
7	MONTH WITH THE BEST WEATHER	$100	JUNe ($33)	JULy ($31)	MAY ($22)	AUG[UST] ($7)	SEP[TEMBER] ($3)	APR[IL] ($2)	OCT[OBER] ($2)
6	OCCASION FOR A BIG PARTY	$97	BIRTHDAY ($35)	NEW+YEARS[+EVE] ($31)	WEDDING ($13)	ANNIVERSARY ($10)	(CHRIST/X+)MAS ($6)	GRADUATION ($2)
4	THAT HAS A CAPTAIN	$100	SHIP/BOAT/YA[CH]T ($91)	[SPORTs+]TEAM ($4)	[AIR]PLANE ($3)	ARMY ($2)
6	PEOPLE KEEP IN OR BEHIND THEIR CAR'S SUN VISOR	$92	MIRROR ($34)	GLASSES/[* ]GLASSES ($27)	REGIST[RATION] ($14)	MAP ($13)	CIGARETTES ($2)	PEN[CIL] ($2)
5	NATIONALLY KNOWN NEWSPAPER COLUMNIST	$85	[DEAR+]ABBY/ABIGAIL+VAN+BUREN ($33)	ANN+LANDERS ($26)	[J[ACK]+]ANDERSON ($13)	[ERMA+]BOMBECK ($9)	[ART+]BUCHWALD ($4)
7	PEOPLE HAVE TROUBLE GETTING OUT OF	$73	[SMALL+]CAR ($20)	BED ($15)	DEBT/BILLS ($13)	LIES/FIBS ($8)	JAIL/PRISON ($6)	TROUBLE ($6)	BATH[TUB]/TUB ($5)
5	BESIDES A STOVE THAT PEOPLE BURN THEMSELVES ON	$78	IRON ($29)	MATCHES ($23)	CIGARETTES ($12)	HEATER/FURNACE ($7)	POTS/PANS ($7)
5	PLACE WHERE YOU'D ASK A STRANGER TO *SAVE YOUR PLACE*	$43	BUS ($19)	[BALL+]GAME/SPORT/ARENA ($10)	AIRPORT ($7)	MOVIE/THEATER ($5)	CHURCH ($2)
5	A SON BORROWS FROM HIS FATHER BEFORE AN IMPORTANT DATE	$100	CAR/* CAR ($72)	MONEY/CASH ($12)	COLOGNE/AFTERSHAVE ($10)	RAZOR/[* ](RAZOR/SHAVER) ($4)	TIE/* TIE ($2)
6	CAR THAT REALLY SAVES GAS	$91	VOLKSWAGEN/VW ($50)	HONDA ($13)	DATSUN ($12)	TOYOTA ($11)	CHEVETTE ($3)	ELECT[RIC]+CAR ($2)
6	FAMOUS PERSON WHOSE LAST NAME IS *WILLIAMS*	$91	ANDY ($52)	ROBIN ($11)	PAUL ($10)	TENNESSEE ($8)	HANK ($6)	CINDY ($4)
5	FAMOUS SKYSCRAPER	$98	EMPIRE+STATE ($74)	SEARS+TOWER ($10)	WORLD+TRADE[+CENTER] ($7)	[J[OHN]+]HANCOCK[ *] ($5)	EIFFEL TWR/EIFFEL+TOWER ($2)
5	ROOM OF THE HOUSE WHERE MOST FAMILY PROBLEMS ARE DISCUSSED	$100	KITCHEN ($45)	FAMILY+ROOM ($18)	LIVING+ROOM ($18)	DINING+ROOM ($13)	BEDROOM ($6)
5	THAT'S HARD TO STOP DOING ONCE YOU START	$97	SMOKING ($68)	EATING ($19)	BITING+[FINGER]NAILS/[FINGER]NAIL+BITING ($5)	GAMBLING ($3)	DRINKING ($2)
6	THAT'S DANGEROUS TO KEEP AROUND THE HOUSE	$94	GUNS ($40)	GASOLINE/GAS ($25)	POISON/INSECTICIDE ($22)	THINNER/SOLVENT/PAINT ($3)	MATCHES ($2)	OILY+RAGS ($2)
5	FLASHY COLOR	$94	RED ($53)	[HOT+/FLuOREScENT+]PINK ($18)	ORANGE ($12)	PURPLE ($7)	SILVER ($4)
6	BUSINESS PARTNERS SHARE	$89	PROFITS/INCOME/MONEY ($53)	[AN/THE]+OFFICE ($15)	[A/THE]+SECRETARY ($8)	EXPENSES/BILLS/DEBTS ($7)	OWNERSHIP/STOCK ($3)	PROBLEMS/TROUBLE ($3)
5	THAT YOU HAVE TO MAKE SURE DOESN'T FREEZE IN THE WINTER	$96	[WATER+]PIPES ($42)	RADIATOR/* RADIATOR/CAR[+WATER] ($26)	PLANTS/VEGETABLES ($20)	YOURSELF ($5)	GAS[+TANK] ($3)
5	THAT TOURISTS WANDER AROUND LOOKING FOR	$83	(REST/BATH)ROOMs ($32)	GIFTS/SOUVENIRS/PRESENTS ($25)	LANDMARKS/MONUMENT ($9)	RESTAuRANTS/EAT/FOOD ($9)	(H/M)OTEL ($8)
5	YOU SEE OUTSIDE A SCHOOL	$93	FLAG ($39)	PLAYGROUND/EQUIPMENT ($30)	KIDS/CHILDREN ($10)	[ATHLETIC/PLAY[ING]]+FIELD ($7)	[SCHOOL+]BUS[ES] ($7)
6	YOU KEEP NEAR THE BED WHEN YOU'RE SICK	$92	TISSUES/KLEENEX ($35)	WATER/* WATER/LIQUIDS/DRINK/JUICE ($21)	MEDIC(ATION/INE)/PILLS ($13)	BUCKET/BASIN/PAIL/BEDPAN ($12)	THERMOMETER ($6)	WASTE+BASKET/(TRASH+/GARBAGE)CAN ($5)
5	SMELL ASSOCIATED WITH CAMPING IN THE WOODS	$98	FIRE/SMOKE ($54)	EVERGREENS/TREE/PINE ($24)	COOKING/FOOD ($12)	FRESH+AIR ($4)	SKUNK ($4)
3	FRUIT PEOPLE BUY FROZEN	$97	STRAWBERRY ($88)	BLUEBERRY ($5)	PEACHES ($4)
5	PIECE OF CLOTHING MADE IN A *ONE SIZE FITS ALL* SIZE	$75	PANTYHOSE/STOCKINGS ($23)	SO(CKS/X) ($21)	GLOVES/MITTENS ($16)	[BATH]ROBE ($8)	CAP/HAT ($7)
6	STATE IN WHICH YOU THINK IT'S THE EASIEST TO FIND A JOB	$74	CAL[IFORNIA]/CA ($35)	NEW+YORK/NY ($12)	ALASKA/AK ($9)	TEXAS/TX ($8)	FLORIDA/FL ($5)	ILLINOIS/IL ($5)
3	MUSICAL INSTRUMENT THAT NEEDS FREQUENT TUNING	$98	GUITAR ($38)	PIANO ($36)	VIOLIN ($24)
6	CITY IN TEXAS	$93	DALLAS ($50)	HOUSTON ($27)	SAN+ANTONIO ($6)	AUSTIN ($4)	EL+PASO ($4)	ABILENE ($2)
6	DESSERT MOTHERS MAKE	$96	CAKE/* CAKE ($27)	GELATIN/JELLO ($25)	PIE/* PIE ($20)	PUDDING/* PUDDING ($17)	BROWNIES ($5)	COOKIES/* COOKIES ($2)
8	STATE WHERE COTTON IS GROWN	$97	ALABAMA/AL ($37)	GEORGIA/GA ($30)	MISSISSIPPI/MS ($11)	LOUISIANA/LA ($8)	S[OUTH]+CAROLINA/SC ($4)	TEXAS/TX ($3)	CALIFORNIA/CA ($2)	N[ORTH]+CAROLINA/NC ($2)
7	ANIMAL KIDS PRETEND TO BE	$98	DOG ($46)	HORSE ($18)	CAT ($14)	LION ($8)	RABBIT ($7)	BEAR ($3)	MONKEY ($2)
5	MAGAZINE WITH JOKES IN IT	$91	PLAYBOY ($44)	MAD ($22)	READERS+DIGEST ($20)	NEW+YORKER ($3)	NAT([']L/IONAL)+LAMPOON ($2)
12	AGE WHEN PEOPLE START ACTING LIKE GROWN-UPS	$98	16 ($15)	18 ($15)	21 ($14)	25 ($13)	17 ($8)	20 ($8)	15 ($7)	30 ($7)	14 ($4)	13 ($3)	19 ($2)	24 ($2)
5	COMMON COLOR FOR GLOVES	$100	BROWN ($40)	BLACK ($36)	WHITE ($12)	BEIGE/TAN ($10)	GR(A/E)Y ($2)
6	HOW LONG IN MINUTES DOES A WEDDING CEREMONY LAST	$97	30 ($44)	60 ($17)	15 ($16)	20 ($10)	10 ($6)	45 ($4)
8	SUMMER FRUIT	$93	WATERMELON ($40)	PEACH ($17)	APPLE ($13)	STRAWBERRY ($10)	CANTALOUPE ($5)	ORANGE ($4)	CHERRY ($2)	PEAR ($2)
9	FRUIT USED IN CAKE	$99	PINEAPPLE ($23)	CHERRY ($18)	APPLE ($15)	STRAWBERRY ($15)	BANANA ($12)	LEMON ($6)	ORANGE ($4)	RAISIN ($4)	PEACH ($2)
9	YOU PUT ON A HAMBURGER	$100	(CATS/KETCH)UP ($41)	ONION ($18)	MUSTARD ($13)	PICKLE ($12)	CHEESE ($4)	RELISH ($4)	BUN ($3)	LETTUCE ($3)	TOMATO ($2)
7	YOU LIGHT WITH A MATCH	$98	CIGARETTE ($47)	CANDLE ($18)	FIRE ($13)	CIGAR ($10)	STOVE ($5)	LANTERN ($3)	PIPE ($2)
7	SPORT WITH SCREAMING FANS	$97	FOOTBALL ($48)	BASEBALL ($23)	HOCKEY ($10)	BASKETBALL ($5)	BOXING ($5)	WRESTLING ($4)	SOCCER ($2)
7	SPORT THAT USES A SMALL BALL	$99	GOLF ($37)	BASEBALL ($28)	PING+PONG/TABLE+TENNIS ($15)	TENNIS ($13)	HANDBALL ($2)	PADDLEBALL ($2)	RAC(QU/K)ETBALL ($2)
4	A BURGLAR FORCES OPEN	$99	WINDOW ($56)	DOOR ($32)	SAFE/VAULT ($9)	LOCK ($2)
6	ON A SCALE OF 1 TO 10 HOW MUCH DO YOU LIKE YOURSELF	$97	8 ($35)	9 ($16)	10 ($16)	7 ($15)	5 ($9)	6 ($6)
10	TIMES HAVE YOU STARTED A DIET THIS YEAR	$94	2 ($19)	3 ($18)	0 ($16)	1 ($9)	10 ($9)	4 ($8)	5 ($8)	6 ($3)	12 ($2)	20 ($2)
6	NON-COLA FLAVOR OF SODA POP	$99	LEMON+LIME/LIME/SEVEN+UP ($36)	ORANGE ($26)	GRAPE ($16)	STRAWBERRY ($10)	(ROOT/BIRCH)+BEER ($8)	CHERRY ($3)
8	TIMES DOES A PERSON CHANGE HIS RESIDENCE	$96	5 ($36)	3 ($24)	4 ($10)	10 ($10)	7 ($5)	2 ($4)	6 ($4)	12 ($3)
8	COLORED ORANGE	$94	ORANGE ($54)	PUMPKIN ($20)	SUN ($6)	TANGERINE ($4)	CARROT ($3)	[FALL+]LEAVES ($3)	BASKETBALL ($2)	CRAYON ($2)
5	YOU MIGHT RUN OUT TO BUY FIRST THING IN THE MORNING	$90	MILK ($36)	NEWSPAPER/PAPER ($25)	COFFEE ($19)	DO[UGH]NUTS ($6)	OR+JUICE/ORANGE+JUICE ($4)
5	THAT'S USUALLY MORE EXPENSIVE THE LARGER IT IS	$95	JEWELRY/DIAMOND ($33)	HOUSE/HOME ($26)	CAR/AUTO* ($23)	TV[+SET]/TELEVISION ($9)	BOAT/SHIP/YACHT ($4)
5	BRAND OF SOFT DRINKS	$94	COCA+COLA/COKE ($57)	PEPSI+COLA ($27)	DR+PEPPER ($5)	SEVEN+UP ($3)	SHASTA ($2)
7	WOMEN WEAR IN THEIR HAIR	$97	HAIR+PINS/BOBBYPIN ($58)	BARRETTE ($11)	RIBBON ($11)	CURLERS/ROLLERS ($10)	BOW ($3)	CLIPS ($2)	HAIR+NET ($2)
4	BRIGHT COLOR	$96	RED ($47)	YELLOW ($29)	ORANGE ($13)	PINK ($7)
7	APPROXIMATELY HOW MANY DOLLARS DOES ONE BAG OF GROCERIES COST	$97	20 ($30)	15 ($22)	25 ($20)	10 ($14)	30 ($4)	40 ($4)	50 ($3)
5	CHILD'S FAVORITE DRINK	$97	SODA+POP/POP ($34)	KOOL+AID ($30)	MILK ($28)	[FRUIT+]PUNCH ($3)	JUICE/* JUICE ($2)
6	A BARBER USES	$96	SCISSORs/SHEaRs ($44)	RAZOR ($22)	COMB ($13)	CLIPPERS ($9)	(SHAVE/SHAVING)+CREAM ($6)	TONIC ($2)
7	BRAND OF GASOLINE	$95	SHELL ($34)	TEXACO ($17)	EXXON/EXON/ESSO ($15)	CHEVRON/STANDARD ($11)	MOBIL ($8)	ARCO ($6)	GULF ($4)
5	COMMON COLOR FOR HATS	$97	BROWN ($41)	BLACK ($36)	GR(A/E)Y ($10)	BLUE ($6)	WHITE ($4)
10	AGE WHEN YOUR *YOUTH* ENDS	$92	21 ($20)	30 ($17)	25 ($13)	40 ($11)	18 ($10)	20 ($7)	19 ($6)	50 ($4)	16 ($2)	35 ($2)
8	VEGETABLE YOU CHOP	$97	ONIONS/SCALLIONS ($45)	CELERY ($20)	CARROTS ($15)	CABBAGE ($7)	BROCCOLI ($4)	LETTUCE ($2)	PEPPERS ($2)	SPINACH ($2)
7	MOST DIFFICULT AGE FOR A GIRL	$97	13 ($24)	15 ($24)	16 ($23)	14 ($13)	12 ($7)	17 ($4)	11 ($2)
4	FORM OF TRANSPORTATION USED ON ICE OR SNOW	$97	SLED/SLEIGH/SLEY ($40)	SNOW+MOBILE ($24)	SKIS ($21)	ICE+SKATES ($12)
6	PEOPLE CARRY IN THEIR HANDS AS THEY BOARD AIRPLANES	$90	TICKET/BOARDING+PASS ($33)	LUGGAGE/BAGGAGE/CARRY+ON+BAG/SUITCASE ($27)	BOOK/MAGAZINE/NEWSPAPER/READ[ING+MATERIAL] ($11)	PURSE/POCKETBOOK/[HAND]BAG ($11)	COAT/JACKET ($5)	CAMERA ($3)
6	ON A SCALE OF 1 TO 10 HOW MUCH DO PEOPLE LIKE BEING MARRIED	$97	10 ($38)	8 ($22)	9 ($19)	7 ($8)	5 ($7)	1 ($3)
6	COLOR OF THE RAINBOW	$96	BLUE ($27)	RED ($21)	YELLOW ($21)	ORANGE ($10)	GREEN ($9)	PURPLE/VIOLET ($8)
8	PAIRS OF JEANS DO YOU HAVE	$94	3 ($26)	4 ($16)	5 ($15)	2 ($14)	0 ($9)	1 ($8)	6 ($3)	10 ($3)
7	THAT OFTEN GETS UNFASTENED	$93	ZIPPER/PANTS/FLY ($21)	BRA ($20)	BUTTONS ($18)	SHOELACE ($17)	BELT+BUCKLE ($7)	SNAPS ($7)	NECKLACE/JEWELRY/BRACeLET ($3)
7	APPROXIMATELY HOW MANY PHONE CALLS DO YOU MAKE PER DAY	$98	3 ($32)	5 ($21)	2 ($19)	1 ($7)	4 ($7)	6 ($6)	10 ($6)
7	BREED OF DOG WITH FLOPPY EARS	$92	BASSET[+HOUND] ($29)	BEAGLE ($29)	[COCKER+]SPANIEL ($21)	DACHSHUND ($4)	POODLE/* POODLE ($3)	S[AIN]T+BERNARD ($3)	SHEEP+DOG ($3)
6	BRAND OF DEODORANT SOAP	$100	DIAL ($49)	COAST ($12)	IRISH+SPR[ING] ($12)	LIFEBuOY ($10)	SAFEGUARD ($10)	ZEST ($7)
6	FOUND IN MOVIE THEATERS	$96	POPCORN ($35)	SCREEN ($33)	SEATS ($18)	SNACK+BAR ($4)	USHER ($4)	[MOVIE+]PROJECTOR ($2)
7	SPORT WHERE PEOPLE SAY *GOOD SHOT*	$98	GOLF ($31)	BASKETBALL ($26)	HOCKEY ($16)	POOL/BILLIARDS ($11)	TENNIS ($8)	DARTS ($4)	BOWLING ($2)
6	ZOO ANIMAL THAT PEOPLE LIKE TO FEED	$99	MONKEY/APE/CHIMP/GORILLA ($47)	ELEPHANT ($38)	BEAR ($7)	SEAL ($3)	DEER ($2)	GIRAFFE ($2)
9	FOOD KEPT REFRIGERATED	$99	MILK ($33)	MEAT ($27)	CHEESE ($13)	ICE+CREAM ($7)	EGGS ($6)	BUTTER ($4)	GELATIN/JELLO ($4)	MAYO[NNAISE] ($3)	POTATO SALAD ($2)
4	STATE THAT GROWS LOTS OF FRUIT	$100	CALIFORNIA/CA ($51)	FLORIDA/FL ($43)	HAWAII/HI ($3)	WASHINGTON/WA ($3)
9	MILES PER GALLON DOES AN *ECONOMY CAR* GET	$91	30 ($35)	25 ($16)	35 ($14)	40 ($8)	32 ($6)	20 ($4)	28 ($3)	50 ($3)	45 ($2)
8	AFTER HOW MANY YEARS OF MARRIAGE DO COUPLES USUALLY GET DIVORCED	$97	5 ($34)	10 ($17)	3 ($13)	7 ($12)	2 ($10)	20 ($5)	15 ($4)	1 ($2)
5	THAT BAD DRIVERS ARE ALWAYS BUMPING INTO	$98	[OTHER+](CARS/AUTO*) ($45)	CURBs ($45)	POLES/* POLES ($4)	GARAGE[+DOORs] ($2)	MAILBOX[ES] ($2)
8	QUIET ANIMAL	$96	MOUSE ($27)	RABBIT ($20)	CAT ($18)	DEER ($14)	TURTLE ($5)	FISH ($4)	GIRAFFE ($4)	HAMSTER ($4)
6	PART OF THE BODY PEOPLE WEAR JEWELRY ON	$100	FINGER ($39)	NECK ($35)	WRIST ($12)	EAR ($8)	ANKLE ($4)	NOSE ($2)
8	HOUR AT WHICH YOU GET DRESSED ON WEEKENDS	$95	10 ($27)	9 ($23)	8 ($13)	12 ($11)	11 ($10)	7 ($6)	1 ($3)	2 ($2)
7	MADE OF LEATHER	$99	BELT ($27)	SHOES ($25)	PURSE/POCKETBOOK/[HAND]BAG ($22)	WALLET/BILLFOLD ($9)	COAT/JACKET ($8)	BOOTS ($6)	GLOVES ($2)
9	BIRD RECOGNIZED BY ITS COLOR	$94	BLUEJAY ($26)	CARDINAL ($25)	BLUEBIRD ($16)	ROBIN ($14)	PEACOCK ($5)	BLACKBIRD ($2)	PARAKEET ($2)	PARROT ($2)	REDBIRD ($2)
7	MINUTES DO YOU BOIL PASTA	$91	10 ($34)	5 ($17)	7 ($11)	8 ($11)	12 ($9)	20 ($7)	15 ($2)
8	RECORD COMPANY	$91	CAPITOL ($31)	RCA ($28)	COLUMBIA ($14)	MCA ($7)	APPLE ($5)	ATLANTIC ($2)	ELEKTRA/ASYLUM ($2)	MOTOWN ($2)
7	ANIMAL THAT'S LARGER THAN A PERSON	$95	ELEPHANT ($41)	HORSE ($22)	BEAR ($15)	APE/GORILLA ($7)	GIRAFFE ($4)	WHALE ($4)	COW ($2)
7	STATE WITH FAMOUS COLLEGES	$93	CALIFORNIA/CA ($43)	MASS[ACHUSETTS]/MA ($21)	NEW+YORK/NY ($11)	PENN[SYLVANIA]/PA ($7)	TEXAS/TX ($5)	VIRGINIA/VA ($4)	INDIANA/IN ($2)
5	A BABY USES	$94	DIAPERS ($43)	BOTTLE ($34)	PACIFIER ($6)	RATTLE ($6)	CRIB ($5)
11	THAT HARDENS AS IT COOLS	$95	GELATIN/JELLO ($36)	CANDY ($23)	WATER ($15)	PUDDING/* PUDDING ($5)	FROSTING/ICING ($3)	METAL ($3)	CEMENT/CONCRETE ($2)	COOKIES ($2)	LAVA ($2)	TAR ($2)	WAX ($2)
7	CITY OFTEN SEEN IN MOVIES	$95	NEW+YORK/NYc ($58)	LOS+ANGELES/LA ($16)	FRISCO/SAN+FRAN[CISCO] ($11)	LONDON ($3)	PARIS ($3)	CHICAGO ($2)	LAS+VEGAS ($2)
7	AGE WHEN WOMEN START LYING ABOUT THEIR AGE	$97	40 ($39)	30 ($25)	35 ($16)	39 ($7)	29 ($4)	50 ($4)	25 ($2)
5	METAL POTS AND PANS ARE MADE OF	$98	ALUMINUM ($55)	STEEL/STAINLESS ($28)	COPPER ($11)	IRON ($2)	TEFLON ($2)
6	TOY WITH WHEELS	$100	TRUCK ($27)	WAGON ($23)	CAR ($19)	TRICYCLE/TRIKE ($15)	BICYCLE/BIKE ($14)	TRAIN ($2)
8	DOOR YOU OPEN OFTEN	$97	FRIDGE/REFRIGERATOR/ICEBOX ($29)	FRONT ($24)	BATHROOM ($23)	CAR ($12)	GARAGE ($3)	CLOSET ($2)	CUPBOARD/CABINET/PANTRY ($2)	KITCHEN ($2)
7	TICKLISH SPOT ON PEOPLE	$99	FEET/TOES ($49)	RIBS ($22)	UNDER+ARMS/ARMPIT ($13)	STOMACH ($9)	EARS ($2)	NECK ($2)	NOSE ($2)
8	TIMES DO SMOKERS TRY TO QUIT SMOKING BEFORE THEY SUCCEED	$91	3 ($24)	5 ($18)	10 ($18)	2 ($11)	1 ($8)	4 ($6)	15 ($3)	25 ($3)
8	FOOD THAT TASTES BETTER WITH BUTTER	$97	BREAD/TOAST ($37)	CORN ($26)	POTATOES ($17)	ROLLS ($8)	LOBSTER ($3)	BAGEL ($2)	GRITS ($2)	MUFFINS/* MUFFINS ($2)
7	MAN'S FIRST NAME THAT BEGINS WITH THE LETTER *J*	$91	JOHN ($35)	JAMES ($22)	JACK ($15)	JOSEPH/JOE ($10)	JAY ($4)	JASON ($3)	JEFFREY ($2)
8	TOOL EVERYONE USES	$96	HAMMER ($49)	SCREWDRIVER ($24)	CAN+OPENER ($5)	FORK ($5)	KNIFE ($4)	SAW ($4)	PENCIL ($3)	WRENCH ($2)
4	COLOR IN FIRE	$98	RED ($42)	ORANGE ($36)	YELLOW ($15)	BLUE ($5)
6	OCCUPATION IN WHICH YOU RISK YOUR LIFE	$86	POLICE+WORK/LAW/COP/OFFICER ($37)	FIRE(+FIGHTER/MAN) ($30)	STUNT(+WORK/MAN) ($8)	PILOT/* PILOT ($6)	SOLDIER ($3)	BUILDER/CONSTRUCTION ($2)
5	NAME SOMEONE WHO USES A WAND	$98	MAGICIAN ($44)	FAIRY[+GODMOTHER] ($32)	CONDUCTOR/MAESTRO/BANDLEADER ($11)	WITCH ($8)	WIZARD/SORCERER ($3)
11	LIVING THING THAT SCARES PEOPLE	$94	SNAKE ($34)	SPIDER ($17)	LION ($12)	DOG ($7)	SHARK ($6)	TIGER ($5)	RAT ($4)	MICE/MOUSE ($3)	BIGFOOT ($2)	BURGLAR/ROBBER/THIEF/CROOK ($2)	WOLF ($2)
5	WHAT IS ANOTHER WORD FOR *FRIEND*	$96	PAL ($57)	BUDDY ($28)	AMIGO ($6)	ACQUAINT[ANCE] ($3)	COMPANION ($2)
6	BOARD GAME WITH COMPLICATED RULES	$95	CHESS ($40)	MONOPOLY ($38)	BACKGAMMON ($7)	RISK ($6)	LIFE ($2)	SCRABBLE ($2)
6	THAT COMES FROM A MINE	$98	COAL ($44)	GOLD ($41)	SILVER ($5)	DIAMONDS ($3)	IRON ($3)	TIN ($2)
9	AGE AT WHICH YOU WOULD LIKE TO RETIRE	$91	50 ($19)	55 ($19)	60 ($19)	65 ($14)	45 ($5)	70 ($5)	75 ($4)	35 ($3)	63 ($3)
9	ARTICLE OF CLOTHING COLORED BLACK	$87	SO(CKS/X) ($25)	SHOES ($19)	PANTS/SLACKS/TROUSERS ($14)	DRESS ($7)	SUIT/TUXEDO ($5)	SWEATER ($5)	BELT ($4)	COAT/JACKET ($4)	GLOVES/MITTENS ($4)
7	DIVE IN A SWIM MEET	$100	SWAN+DIVE ($49)	JACK+KNIFE ($31)	GAINER ($8)	BACK+FLIP ($5)	HIGH+DIVE ($3)	FREE+STYLE ($2)	SWIRL/TWIST ($2)
4	COLOR OF TOOTHPASTE	$99	WHITE ($60)	BLUE ($18)	GREEN ($14)	RED ($7)
7	HOW LONG IN WEEKS DOES IT TAKE TO LOSE 10 POUNDS	$95	4 ($30)	2 ($27)	8 ($18)	3 ($6)	12 ($6)	1 ($4)	24 ($4)
6	DESSERT YOU MOST OFTEN SERVE WHEN YOU HAVE COMPANY	$97	CAKE/* CAKE ($45)	PIE/* PIE ($27)	ICE+CREAM ($17)	GELATIN/JELLO ($4)	FRUIT ($2)	MOUSSE/* MOUSSE ($2)
6	AUTUMN COLOR	$99	ORANGE ($32)	BROWN ($21)	GOLD ($17)	RED ($12)	RUST ($11)	YELLOW ($6)
7	ANIMAL THAT BIG GAME HUNTERS HUNT	$98	LION ($25)	ELEPHANT ($24)	DEER ($17)	BEAR ($13)	TIGER ($9)	MOOSE ($7)	ELK ($3)
5	NOISIEST ROOM IN YOUR HOUSE	$100	KITCHEN ($38)	(FAMILY/TV/TELEVISION)+ROOM/DEN ($29)	LIVING+ROOM ($25)	(PLAY/KIDS/CHILD[REN])+ROOM ($5)	BED+ROOM ($3)
6	MADE WITH COCONUT	$99	PIE ($37)	CAKEs ($19)	DRINKS ($17)	CANDY ($14)	COOKIEs/MACAROONS ($9)	TAN[NING]+(LOTION/OIL)/OIL ($3)
6	BRAND OF CAMERA	$100	KODAK ($59)	CANON ($15)	POLAROID ($12)	MINOLTA ($6)	PENTAX ($6)	NIKON ($2)
5	TYPE OF SLIPPER	$95	BEDROOM/HOUSE ($46)	GLASS ($26)	BALLET ($16)	MOCCASIN ($5)	SATIN ($2)
5	PLACE WHERE YOU'RE PARTICULARLY BOTHERED BY PEOPLE WHO SMOKE	$80	RESTAURANT ($48)	CAR/AUTO* ($12)	[AIR]PLANE ($7)	ELEVATOR ($7)	BAR ($6)
4	COLOR WORN BY BUSINESS EXECUTIVES	$100	GR(A/E)Y ($47)	BLUE/NAVY[+BLUE] ($42)	BROWN ($8)	BLACK ($3)
6	BODY PART THAT TENSES WHEN YOU'RE NERVOUS	$98	NECK/THROAT/SHOULDER ($31)	HEAD ($24)	STOMACH ($22)	HANDS ($9)	BACK ($8)	LEGS/KNEES ($4)
6	BEST COLOR FOR A CAR INTERIOR	$100	BLUE/NAVY ($32)	BEIGE/TAN ($26)	BLACK ($16)	BROWN ($15)	RED ($9)	WHITE ($2)
6	HOURS CAN YOU SPEND SHOPPING BEFORE YOU GET TIRED	$94	2 ($35)	3 ($24)	4 ($15)	1 ($9)	5 ($6)	6 ($5)
5	FRUIT-FLAVORED ICE CREAM	$99	STRAWBERRY ($59)	PEACH ($15)	CHERRY ($13)	TUTTI+FRUTTI ($10)	ORANGE ($2)
4	PET BIRD KEPT IN A CAGE	$99	CANARY ($38)	PARROT ($30)	PARAKEET ($29)	MYNA ($2)
5	AN AIRPLANE NEEDS TO FLY	$99	WINGS ($39)	FUEL/GAS ($37)	ENGINE/MOTOR/JET ($12)	PILOT ($8)	PROPELLER ($3)
7	FRUIT USED IN MAKING DAIQUIRIS	$98	STRAWBERRY ($33)	BANANA ($28)	LIME ($18)	CHERRY ($8)	LEMON ($6)	PINEAPPLE ($3)	ORANGE ($2)
5	NAME AMERICA'S FAVORITE VACATION SPOT	$99	FLORIDA/FL ($46)	CALIFORNIA/CA ($26)	HAWAII/HI ($20)	COLORADO/CO ($5)	TEXAS/TX ($2)
3	PRESIDENT KNOWN BY HIS INITIALS	$98	JFK ($58)	FDR ($20)	LBJ ($20)
9	HOW MUCH IN DOLLARS DOES A MARRIAGE LICENSE COST	$94	5 ($35)	10 ($21)	3 ($13)	2 ($7)	6 ($5)	12 ($4)	15 ($4)	7 ($3)	20 ($2)
8	JOB IN A RESTAURANT	$97	WAIT(RESS/ER) ($52)	COOK/CHEF ($22)	BUS+BOY ($8)	HOSTESS ($5)	CASHIER ($3)	MAiT(RE/ER)+D ($3)	DISHWASHER ($2)	MANAGER/OWNER ($2)
5	BODY PART THAT GETS THE COLDEST WHEN YOU'RE OUTSIDE	$98	FACE/NOSE ($41)	FEET/TOES ($27)	HANDS/FINGERS ($21)	EARS ($7)	LEGS ($2)
5	BEVERAGE YOU DRINK MOST	$92	SODA[+POP]/POP ($42)	COFFEE ($14)	WATER ($14)	MILK ($11)	[ICED+]TEA ($11)
7	LENS COLOR IN SUNGLASSES	$98	GREEN ($30)	BROWN ($20)	GR(A/E)Y/SMOKE ($20)	BLUE ($19)	BLACK ($4)	YELLOW ($3)	PINK/ROSE ($2)
5	AILMENT PEOPLE SAY THEY HAVE WHEN THEY CALL IN SICK TO WORK	$97	FLU ($46)	COLD ($36)	HEADACHE ($10)	VIRUS ($3)	SORE+THROAT ($2)
6	COLOR OF FLOWERS IN HAWAII	$100	PINK ($30)	RED ($24)	YELLOW ($17)	WHITE ($14)	PURPLE/LAVENDER/ORCHID ($13)	ORANGE ($2)
7	USED TO APPLY MAKE-UP	$99	BRUSH ($47)	POWDER+PUFF ($13)	FINGERS/HAND ($11)	COTTON[+BALLS] ($9)	MIRROR ($8)	SPONGE ($8)	PENCIL/* PENCIL ($3)
6	PIECE OF CLOTHING WORN OVER OTHER CLOTHES	$96	COAT/JACKET ($47)	SWEATER ($25)	BLOUSE/SHIRT ($8)	VEST ($8)	PANTS/TROUSERS/SLACKS ($6)	DRESS ($2)
8	AVERAGE WEIGHT IN POUNDS PEOPLE LOSE ON A SUCCESSFUL DIET	$97	20 ($34)	10 ($29)	25 ($13)	15 ($10)	5 ($3)	30 ($3)	40 ($3)	50 ($2)
6	VEGETABLE YOU BUTTER	$96	CORN ($53)	POTATOES ($22)	PEAS ($11)	BEANS ($5)	BROCCOLI ($3)	ARTICHOKES ($2)
5	PART OF YOUR BODY THAT HELPS YOU KEEP YOUR BALANCE	$97	FEET/TOES ($38)	ARMS ($25)	INNER+EAR ($20)	LEGS ($8)	BRAIN ($6)
4	PART OF THE SCHOOL DAY	$96	RECESS ($52)	LUNCH ($40)	HOMEROOM ($2)	STUDY+HALL ($2)
9	SUMMER VACATION STATE	$94	FLORIDA/FL ($42)	CALIFORNIA/CA ($17)	HAWAII/HI ($9)	MAINE/ME ($7)	VERMONT/VT ($5)	COLORADO/CO ($4)	MICHIGAN/MI ($4)	WISCONSIN/WI ($4)	ALASKA/AK ($2)
9	TYPE OF PRODUCT ADVERTISED AS *HEAVY DUTY*	$97	DETERGENTs/CLEANERs ($34)	TRASH+BAGs/GARBAGE ($23)	BATTERY ($13)	[TIN+/ALUMINUM+]FOIL ($9)	OIL ($5)	PAPER+TOWELs ($4)	WASH(ER/ING+MACHINE) ($4)	SOAP ($3)	TIRES ($2)
8	AT WHAT AGE DO MOST PEOPLE BECOME COMPLETELY SELF-SUPPORTING	$95	21 ($37)	25 ($28)	22 ($8)	20 ($7)	23 ($7)	18 ($4)	24 ($2)	27 ($2)
9	THAT PEOPLE TRY TO KEEP OUT OF THE HOUSE	$96	BUGS/INSECTS ($43)	MICE/MOUSE ($17)	DIRT/MUD ($12)	PETS/DOG/CAT ($9)	COLD[+AIR] ($5)	BURGLARS/ROBBERS/THIEVES ($4)	GUNS ($2)	RATS ($2)	SALES(M(E/A)N/PEOPLE) ($2)
6	NEXT TO WATER WHAT IS THE WORLD'S MOST POPULAR BEVERAGE	$100	SODA[+POP]/POP ($37)	BEER ($18)	MILK ($17)	COFFEE ($15)	[ICED+]TEA ($8)	WINE ($5)
6	IN ONE WORD DESCRIBE THE STREETS OF NEW YORK	$94	CROWDED ($30)	BUSY ($23)	DANGEROUS/UNSAFE ($18)	DIRTY ($18)	CRAZY/WILD ($3)	NOISY/LOUD ($2)
5	YOU GET INTO AND OUT OF EVERY DAY	$99	BED ($56)	CLOTHES ($22)	CAR/AUTO* ($15)	SHOWER/BATH*/[BATH]TUB ($4)	HO(USE/ME) ($2)
4	PLACE IN THE HOME WHERE MANY PEOPLE LEAVE A LIGHT ON ALL NIGHT	$96	BATHROOM ($61)	HALLWAY ($21)	KITCHEN ($11)	BEDROOM ($3)
3	THAT COMES IN A CARTON	$94	MILK ($54)	EGGS ($26)	CIGARETTES ($14)
5	PEOPLE WAX	$95	CAR ($64)	FLOORS ($21)	FURNITURE ($5)	SKIS ($3)	MoUSTACHE ($2)
6	IF A TEENAGER HAD SOME EXTRA MONEY WHAT WOULD HE SPEND IT ON	$90	RECORDS/TAPES/CDS ($29)	CLOTHES ($28)	CAR ($12)	FOOD ($10)	VIDEO+GAMES ($7)	MOVIES ($4)
5	CHARACTER IN THE *PEANUTS* COMIC STRIP BESIDES CHARLIE BROWN	$94	SNOOPY ($40)	LUCY ($39)	LINUS ($11)	P'MINT PATTY/P[EPPER]MINT+PATTY ($2)	ScHROeDER ($2)
4	FAMOUS ROCK	$92	GIBRALTAR ($38)	PLYMOUTH ($26)	HUDSON ($25)	PET ($3)
4	ASSOCIATED WITH ATLANTIC CITY	$94	CASINO/GAMBLING ($53)	BOARDWALK ($29)	MISS+AMER[ICA]/PAGEANT ($10)	OCEAN ($2)
7	FAMOUS SHIP REAL OR FICTIONAL	$80	TITANIC ($45)	MAYFLOWER ($10)	QUEEN+MARY ($6)	LOVE+BOAT/PACIFIC PRINCESS ($5)	IRONSIDES/CONSTITUTION ($5)	SANTA+MARIA ($5)	BOUNTY ($4)
8	MAGAZINE YOU TRUST	$74	TIME ($22)	READ DIG/READERS+DIGEST ($15)	NEWSWEEK ($9)	GOOD+HOUSE/GOOD+HOUSEKEEPING ($8)	LIFE ($6)	PEOPLE ($6)	NAT(IONA/')L+GEOG[RAPHIC] ($5)	PARENTS ($3)
3	CHILDREN ARE TOLD THEY ARE *NOT OLD ENOUGH* TO DO	$50	DRIVE ($21)	STAY+UP[+LATE]/LATE ($16)	DATE ($13)
7	THAT'S BLACK AND WHITE	$90	NEWSPAPER ($44)	ZEBRA ($16)	SKUNK ($10)	TV[+SET]/TELEVISION ($9)	POLICE+CAR ($5)	CAT ($3)	PENGUIN ($3)
4	WITH A PROPELLER	$100	[AIR]PLANE ($52)	HELICOPTER ($25)	BOAT/SHIP ($19)	BEANIE/CAP ($4)
6	SOUVENIR PEOPLE BRING BACK FROM HAWAII	$93	LEIS/LAYS ($49)	SHIRT ($14)	PINEAPPLE ($10)	(GRASS/HULA)+SKIRT ($7)	MACADAMIAS/NUTS ($7)	SHELLS ($6)
7	THAT CHANGES FROM GREEN TO YELLOW	$96	LEAVES/LEAF ($33)	TRAF[FIC]+LIGHT ($26)	BANANA ($22)	[DYING+]GRASS ($7)	APPLE ($3)	SQUASH ($3)	LEMON ($2)
5	FAMOUS PIRATE REAL OR FICTIONAL	$96	CAPT+HOOK ($33)	BLACKBEARD ($25)	BLUEBEARD ($22)	LONG+JOHN[+SILVER] ($9)	CAPT+KIDD ($7)
5	CHILDREN LOVE TO RIDE ON	$95	BIKES/TRIKES/BICYCLE/TRICYCLE ($35)	HORSES/PONY ($28)	CAROUSEL/MERRY+GO+ROUND ($27)	SHOULDERS ($3)	ROLL[ER]+COAST[ER] ($2)
4	ELECTRICAL APPLIANCE USED IN THE BATHROOM	$99	[HAIR+/BLOW+]DRYER ($72)	RAZOR ($22)	CURLING+IRON/CURLER ($3)	HEATER ($2)
6	THAT COOLS YOU OFF IN HOT WEATHER	$91	AIR+COND[ITIONING]/AC ($23)	ICED+TEA ($17)	COLD+SHOWER/BATH ($15)	SWIMMING/POOL ($15)	FAN ($14)	LEMONADE ($7)
6	GAME PEOPLE GAMBLE AT IN LAS VEGAS	$100	BLACKJACK/TWENTY+ONE ($69)	CRAPS ($11)	POKER ($7)	ROULETTE ($6)	SLOTS ($4)	KENO ($3)
4	REASON WHY PEOPLE MIGHT LEAVE THEIR SEATS DURING AN INTERMISSION	$98	RESTROOM/BATHROOM ($67)	EAT ($13)	DRINK ($12)	SMOKE ($6)
8	CITY ASSOCIATED WITH SPY MOVIES	$87	LONDON ($33)	PARIS ($19)	NEW+YORK/NYc ($12)	MOSCOW ($6)	WASHINGTON/DC ($6)	BERLIN ($5)	ROME ($3)	FRISCO/SAN+FRANCISCO ($3)
6	YOU DO WHEN YOU CAN'T SLEEP	$92	READ[+A][+BOOK]/READ ($54)	WATCH+(TV/TELEVISION) ($22)	COUNT+SHEEP ($7)	EAT ($5)	DRINK+[WARM+]MILK ($2)	TOSS & TURN/TOSS+[AND+]TURN ($2)
7	HUSBANDS DO THAT ANNOYS THEIR WIVES	$70	LEAVE MESS/LEAVE+*+MESS ($20)	IGNORE+THEM ($14)	[COME/GET]+HOME+LATE ($11)	[WATCH+]TV/[TOO+MUCH]+TV ($10)	SNORE ($8)	DRINK[+TOO+MUCH] ($4)	[PLAY+](POKER/CARDS)/GAMBLE ($3)
5	ASSOCIATED WITH GEORGE WASHINGTON	$85	CHERRY+TREE/(CUT/CHOP)+CHERRY+TREE ($64)	DOLLAR+BILL ($8)	(WOODEN/FALSE)+TEETH ($7)	[CROSS[ING]+]DELAWARE ($3)	MT+VERNON ($3)
6	YOU'RE ASKED TO DO AT THE DOCTOR'S	$96	DISROBE/UNDRESS/TAKE+CLOTHES+OFF ($44)	SAY+AH/OPEN[+MOUTH]+WIDE ($28)	TAKE+[DEEP+]BREATH ($7)	COUGH ($7)	[GET+]WEIGHED/WEIGH ($7)	[GIVE+](HISTORY/INFO) ($3)
4	LIQUID YOU PUT IN YOUR CAR	$99	GAS[OLINE] ($73)	OIL ($15)	WATER ($7)	ANTI+FREEZE ($4)
