6	IDEAL AGE FOR A US PRESIDENT	$91	50 ($40)	45 ($18)	55 ($14)	60 ($9)	40 ($7)	35 ($3)
6	THAT MELTS	$98	ICE+CREAM ($46)	BUTTER ($34)	CHEESE ($7)	SNOW* ($6)	WAX/CANDLE ($3)	CHOCOLATE ($2)
6	YOU EAT THAT'S RED	$90	APPLE ($28)	TOMATO ($23)	CHERRY ($14)	BEETS ($14)	(CATS/KETCH)UP ($6)	JELLO/GELATIN ($5)
8	YEARS DOES A WRISTWATCH LAST	$100	10 ($32)	5 ($30)	3 ($12)	2 ($11)	4 ($7)	20 ($4)	6 ($2)	1 ($2)
10	UNUSUAL PET	$92	SNAKE ($39)	SKUNK ($17)	MONKEY/CHIMP ($13)	[ALlI]GATOR/CROCODILE ($6)	TARANTULA ($4)	RACCOON ($3)	OCELOT ($3)	LION ($3)	BEAR ($2)	ROCK ($2)
11	YEARS DOES A DOG LIVE	$97	10 ($26)	15 ($22)	12 ($20)	14 ($8)	8 ($5)	11 ($4)	20 ($3)	7 ($3)	13 ($2)	5 ($2)	3 ($2)
8	FLAVOR OF HARD CANDY	$97	[PEPPER]MINT ($35)	CHERRY ($25)	LEMON ($16)	BUT[[']/TE]RSCOTCH ($12)	GRAPE ($3)	CHOCOLATE ($2)	CINNAMON ($2)	(ROOT/BIRCH)+BEER ($2)
6	VEHICLE WITH VERY LARGE WHEELS	$93	TRACTOR ($44)	TRUCK ($26)	BULLDOZER ($9)	[AIR]PLANE ($6)	BUS ($4)	[DUNE+]BUGGY ($4)
6	A ROOF IS MADE OF	$96	SHINGLES/WOOD ($45)	ASPHALT/TAR ($29)	SLATE ($10)	TILE ($6)	TIN ($4)	ASBESTOS ($2)
4	PEOPLE WEAR THAT BEGINS WITH THE LETTER *S*	$97	SHIRT ($33)	SHOEs ($32)	SWEATER ($24)	SO(CKs/X) ($8)
10	CARD GAME YOU PLAY BEST	$94	POKER ($26)	GIN[+RUMMY]/RUMMY ($20)	BRIDGE ($14)	PINOCHLE ($7)	UNO ($7)	BLACKJACK/TWENTY+ONE ($6)	CANASTA ($6)	CRIBBAGE ($3)	SOLITAIRE/PATIENCE ($3)	HeARTS ($2)
9	FABRIC MEN'S SUITS ARE MADE OF	$94	WOOL ($37)	POLYESTER ($27)	TWEED ($9)	GABARDINE ($5)	SILK ($5)	COTTON ($4)	FLANNEL ($3)	MOHAIR ($2)	SERGE ($2)
11	FOOD THAT TASTES TERRIBLE COLD	$88	POTATO[ES] ($16)	EGGs ($15)	SOUP ($15)	PIZZA ($13)	SPAGHETTI ($9)	OATMEAL ($6)	STEAK ($5)	[HAM]BURGERs ($3)	CHILI ($2)	COFFEE ($2)	GRAVY ($2)
7	SPEED IN MPH AT WHICH YOU DRIVE ON DESERTED HIGHWAYS	$98	65 ($30)	70 ($24)	60 ($20)	55 ($9)	80 ($9)	75 ($4)	85 ($2)
8	TYPE OF STORE THAT DELIVERS	$97	FURNITURE ($26)	DRUG/PHARMACY ($22)	GROCERY/[SUPER+]MARKET ($16)	PIZZA ($11)	DEPARTMENT ($8)	FLO(RIST/WER[+SHOP]) ($7)	[DRY+]CLEANERs ($4)	APPLIANCE ($3)
5	HOLIDAY WHEN YOU EAT TOO MANY SWEETS	$100	(CHRIST/X+)MAS ($59)	EASTER ($25)	HALLOWEEN ($9)	VALENTINE[[']S][+DAY] ($5)	THANKSGIVING ($2)
7	MOST POPULAR BREED OF DOG	$93	[FRENCH+]POODLE ($39)	[GER[MAN]+]SHEPHERD ($37)	COLLIE ($7)	[COCKER+]SPANIEL ($4)	DALMATIAN ($2)	S[AIN]T+BERNARD ($2)	SCOT(TIE/CH+TERRIER) ($2)
6	THAT MAKES A LOUD BANG	$98	GUN/CANNON/PISTOL/RIFLE ($43)	FIRE(WORKS/CRACKER) ($41)	[AIR]PLANE/SONIC+BOOM ($4)	BALLOON[+BURST[ING]] ($4)	BACKFIRE/CAR/AUTO* ($4)	THUNDER ($2)
7	FOREIGN MONEY	$94	PESO ($23)	FRANC ($22)	MARK ($16)	LIRA ($12)	POUND ($8)	SHILLING ($8)	PESETA ($5)
11	CITY WITH A PRO BASKETBALL TEAM	$95	LOS+ANGELES/LA ($39)	NEW+YORK/NY ($15)	PHILA[DELPHIA] ($11)	BOSTON ($8)	CHICAGO ($5)	KANSAS+CITY/KC ($4)	ATLANTA ($3)	FRISCO/SAN+FRANCISCO ($3)	SEATTLE ($3)	HOUSTON ($2)	S[AIN]T+LOUIS ($2)
8	MADE OF RUBBER	$93	TIRE ($59)	BALL ($12)	[RUBBER+]BAND ($8)	BOOTS/GALOSHES ($6)	ELASTIC ($2)	GLOVES ($2)	HOSE ($2)	NIPPLES ($2)
11	FOOD SERVED WITH TEA	$93	COOKIEs ($24)	CRUMPETs ($21)	CAKEs ($15)	TOAST ($10)	CRACKERs ($5)	SANDWICH ($4)	BISCUITs ($3)	CHICKEN ($3)	DO[UGH]NUTs ($3)	LEMON ($3)	CHOW+MEIN/CHINESE ($2)
8	AGE WHEN GIRLS START KEEPING DIARIES	$99	12 ($31)	13 ($28)	10 ($12)	14 ($9)	15 ($7)	11 ($5)	16 ($5)	9 ($2)
5	BEES DO	$98	MAKE+HONEY ($56)	STING ($29)	BUZZ ($9)	MAKE+WAX ($2)	POLLENATE ($2)
4	SCANDINAVIAN COUNTRY	$100	SWEDEN ($55)	NORWAY ($33)	DENMARK ($10)	FINLAND ($2)
5	PART OF A FISH	$98	FIN ($66)	GILL ($18)	HEAD ($5)	TAIL ($5)	SCALES ($4)
9	ONE APPLIANCE IN YOUR HOME THAT YOU'D HATE TO BE WITHOUT	$95	FRIDGE/REFRIGERATOR/ICEBOX ($24)	STOVE/OVEN/MICROWAVE/RANGE ($24)	WASH(ER/ING+MACHINE) ($23)	DISHWASHER ($11)	TV[+SET]/TELEVISION ($4)	TOASTER ($3)	CAN+OPENER ($2)	COFFEEPOT ($2)	VACUUM ($2)
11	YEARS DOES A BED LAST	$95	10 ($28)	20 ($23)	15 ($19)	25 ($5)	30 ($5)	5 ($3)	50 ($3)	100 ($3)	8 ($2)	35 ($2)	40 ($2)
6	NIGHTS A WEEK DO YOU STAY UP FOR *THE TONIGHT SHOW*	$98	0 ($38)	2 ($21)	3 ($17)	1 ($10)	5 ($8)	4 ($4)
7	A HAIRDRESSER USES	$99	COMB ($25)	[HAIR+]SPRAY ($21)	[HAIR+]BRUSH ($16)	ROLLERS/CURLERS ($13)	[HAIR+/BLOW+]DRYER ($9)	SHAMPOO ($8)	SCISSORS/SHEARS ($7)
6	CAPITAL OF A FOREIGN COUNTRY	$88	PARIS ($32)	ROME ($21)	LONDON ($19)	MOSCOW ($12)	BERLIN ($2)	BEIJING/PEKING ($2)
6	FOOD YOU BUY SMOKED	$99	FISH/SALMON ($44)	HAM ($41)	SAUSAGE ($7)	BACON ($3)	BEEF+JERKY/BEEF ($2)	OYSTERS ($2)
4	NAME ONE OF THE BLANKS ON A BLANK CHECK	$99	DATE ($27)	PAYEE ($26)	AMOUNT ($25)	SIGNATURE/NAME ($21)
8	HOURS A DAY DOES THE AVERAGE AMERICAN WATCH TV	$100	4 ($32)	5 ($24)	3 ($19)	6 ($14)	8 ($4)	2 ($3)	7 ($2)	10 ($2)
6	YOU'D LIKE TO OWN BUT COULD NOT AFFORD THE UPKEEP	$94	BOAT/YA[CH]T ($39)	HO(USE/ME) ($18)	CAR/[COR]VET[TE]/BMW/FERRARI/AUTO* ($17)	HORSE ($11)	POOL ($5)	[AIR]PLANE ($4)
5	GIVE ME ANOTHER WORD FOR *ZERO*	$82	NOTHING/NADA ($26)	ZILCH ($22)	NONE ($16)	ZIP ($16)	NULL ($2)
9	AT WHAT AGE DO MOST MEN MARRY	$98	25 ($38)	22 ($15)	21 ($10)	23 ($9)	24 ($9)	30 ($5)	20 ($4)	26 ($4)	28 ($4)
6	COLOR OF POSTAGE STAMPS	$99	BLUE ($51)	WHITE ($16)	PURPLE ($10)	RED ($9)	GREEN ($7)	BROWN ($6)
11	HOUSES ARE THERE ON A KID'S PAPER ROUTE	$96	50 ($32)	100 ($11)	25 ($9)	75 ($9)	20 ($8)	40 ($8)	30 ($6)	15 ($4)	35 ($4)	150 ($3)	60 ($2)
5	MAKE OF CAR YOU SEE TELEPHONES IN	$100	ROLLS+ROYCE ($43)	CADILLAC ($29)	LINCOLN ($18)	MERCEDES ($8)	CHEV(ROLET/Y) ($2)
10	WELL-KNOWN INSURANCE COMPANY	$93	PRUDENTIAL ($28)	ALLSTATE ($20)	STATE+FARM ($12)	MUTUAL/OMAHA ($11)	J[OHN]+HANCOCK ($5)	MET(+LIFE/ROPOLITAN) ($5)	BLUE+(CROSS/SHIELD) ($4)	HARTFORD ($3)	NATIONWIDE ($3)	LLOYDS ($2)
7	THAT HAS A SPRING INSIDE IT	$98	BED/MATTRESS/BOXSPRING ($32)	CLOCK/WATCH ($32)	PEN ($22)	CHAIR ($4)	GUN ($3)	JACK+IN+[THE+]BOX ($3)	COUCH/SOFA ($2)
7	FRUIT TREE	$97	APPLE ($56)	PEACH ($15)	CHERRY ($8)	ORANGE ($7)	LEMON ($4)	PLUM ($4)	PEAR ($3)
7	ANIMAL BOYS SCARE GIRLS WITH	$100	FROG/TOAD ($33)	SNAKE ($30)	MOUSE/MICE ($12)	SPIDER ($11)	WORM ($9)	LIZARD ($3)	RAT ($2)
7	MADE OF WIRE	$89	FENCE ($32)	[COAT+]HANGER ($26)	CORDS ($10)	CAGE/PEN/KENNEL ($8)	BRACES ($7)	EARRINGs ($3)	SCREEN ($3)
5	VEGETABLE YOU BAKE	$97	POTATO[ES] ($65)	SQUASH/ZUCCHINI ($20)	BEANs ($5)	CARROTs ($5)	BROCCOLI ($2)
6	OCCASION WHEN PEOPLE EAT AND DRINK TOO MUCH	$99	NEW+YEARs ($46)	THANKSGIVING ($20)	(CHRIST/X+)MAS ($14)	WEDDING ($12)	PARTY ($5)	BIRTHDAY ($2)
11	BIRD THAT DOES NOT FLY	$94	OSTRICH ($24)	PENGUIN ($23)	JAILBIRD ($9)	CHICKEN ($8)	ROADRUNNER ($8)	THUNDERBIRD ($7)	DODO ($3)	EMU ($3)	PARROT ($3)	SWAN ($3)	TURKEY ($3)
4	NAME YOUR FAVORITE SUMMERTIME BEVERAGE	$89	ICED+TEA ($41)	LEMONADE ($37)	SODA[+POP]/POP/COKE/PEPSI ($6)	KOOL+AID ($5)
10	COLOR OF YOUR LIVING ROOM CARPET	$99	GREEN ($24)	BROWN ($22)	GOLD ($16)	BEIGE/TAN ($11)	RUST ($9)	BLUE ($8)	RED ($3)	GR(A/E)Y ($2)	ORANGE ($2)	YELLOW ($2)
8	BREED OF LARGE DOG	$96	S[AIN]T+BERNARD ($38)	[GER[MAN]+]SHEPHERD ($22)	GREAT+DANE ($18)	COLLIE ($7)	AFG[H]AN ($5)	DOBERMAN ($2)	GR(E/A)YHOUND ($2)	[IRISH+]SETTER ($2)
4	PEOPLE PUT ON HOT CEREAL	$99	SUGAR ($44)	MILK ($41)	BUTTER ($11)	CREAM ($3)
6	YOU DO TO A HORSE	$97	RIDE ($57)	BRUSH/CURRY/GROOM ($15)	FEED ($9)	SHOE ($8)	KICK ($4)	SADDLE ($4)
4	JOB ON A NEWSPAPER	$97	(REPOR/WRI)TER ($49)	EDITOR ($39)	(TYPESET/PRIN)TER ($7)	PHOTOGRAPH(Y/ER) ($2)
7	THAT'S EASIER TO GET INTO THAN IT IS TO GET OUT OF	$76	TROUBLE ($31)	[SMALL+]CAR/AUTO* ($14)	MARRIAGE ($12)	BED ($9)	BOOTS ($4)	A LIE/[A+]LIE ($3)	TIGHT+PANTS ($3)
4	THAT SWINGS BACK AND FORTH	$94	PENDULUM ($53)	SWING ($32)	[SWINGING+]DOOR ($7)	HAMMOCK ($2)
5	FRUIT YOU EAT WITH BREAKFAST	$98	BANANAs ($37)	GRAPEFRUIT ($36)	ORANGEs ($11)	STRAWBERR(Y/IES) ($11)	MELON ($3)
4	PLACE PEOPLE KEEP IMPORTANT PAPERS	$93	VAULT/[SAFE[TY]+]DEPOSIT+BOX ($48)	SAFE/STRONGBOX ($33)	DESK[+DRAWER]/DRAWER ($6)	FIL(E/ING)+CAB[INET] ($6)
6	GIVE ME ANOTHER WORD FOR *BIG*	$97	LARGE ($51)	HUGE ($35)	GIGANTIC ($4)	GIANT ($3)	ENORMOUS ($2)	HUMONGOUS ($2)
5	COLOR OF INK	$100	BLUE ($54)	BLACK ($21)	RED ($19)	GREEN ($3)	PURPLE/VIOLET ($3)
7	THAT'S *YOURS* AT HOME AND YOU GET UPSET WHEN OTHERS USE IT	$84	[TOOTH+]BRUSH ($36)	BED ($22)	[HAIR+]BRUSH ($9)	COMB ($7)	TOWEL ($4)	CAR/AUTO* ($3)	DEODORANT ($3)
5	MAJOR HOME REPAIR	$92	ROOF ($41)	PLUMBING/* PLUMBING/[* ]PIPES/FAUCET ($30)	HEATING/FURNACE ($12)	PAINTING ($6)	ELECTRICAL/WIRING ($3)
5	JOB IN WHICH WOMEN COMPLAIN THAT MEN ARE ALWAYS MAKING PASSES	$93	SECRETARY/OFFICE/CLERICAL ($43)	WAITRESS ($35)	NURSING ($6)	MODELS ($5)	STEWARDESS/AIRLINE ($4)
4	COUNTRY THAT WAS ONCE AMERICA'S BITTER ENEMY BUT IS NOW HER FRIEND	$97	ENGLAND/[GREAT+]BRITAIN/UNITED+KINGDOM/UK ($35)	JAPAN ($30)	CHINA ($18)	GERMANY ($14)
5	YOU GIVE THANKS FOR IN YOUR PRAYERS	$91	FAMILY/RELATIVES ($37)	HEALTH ($36)	LIFE ($11)	FRIENDS ($4)	EACH DAY ($3)
5	MOST WOMEN ENJOY DOING THAT MOST MEN DON'T CARE FOR AT ALL	$79	SHOPPING ($51)	SEWING/KNITTING ($16)	TALKING/GOSSIP ($6)	COOKING ($3)	DANCING ($3)
6	YOU TRIED TO FIX BUT HAD TO CALL A REPAIRMAN LATER	$89	TV[+SET]/TELEVISION ($41)	CAR/AUTO* ($31)	PLUMBING/FAUCET/PIPES ($5)	RADIO ($5)	CLOCK ($4)	TOASTER ($3)
6	YOU SEE IN A LANDSCAPE PAINTING	$89	TREES ($50)	MOUNTAINS/HILLS ($22)	SKY ($7)	GRASS/FIELD ($4)	BUSHES/SHRUBS ($3)	SUNSET ($3)
7	HOURS DOES A HEADACHE LAST	$95	2 ($34)	1 ($24)	3 ($13)	24 ($12)	4 ($8)	5 ($2)	12 ($2)
6	CIRCUS ANIMAL	$97	LION ($36)	TIGER ($21)	ELEPHANT ($15)	MONKEY/APE ($13)	BEAR ($7)	HORSE ($5)
6	YOU EAT TOO MUCH OF AND GET SICK	$81	CANDY/SWEETS ($60)	ICE+CREAM ($7)	CAKE ($5)	PEANUTS ($3)	SPAGHETTI ($3)	TURKEY ($3)
4	YOU PUT ON A CUT	$96	BAND(AGE/+AID) ($82)	IODINE ($6)	PEROXIDE ($5)	ME[R]THIOLATE ($3)
5	TYPE OF PLACE WHERE PEOPLE CAN KISS IN PUBLIC AND NO ONE NOTICES	$81	TERMINAL/AIRPORT/[TRAIN+/BUS+](STATION/DEPOT) ($39)	[DRIVE+IN+]MOVIE ($30)	PARK ($5)	BEACH ($4)	DISCO ($3)
5	YOU WORRY ABOUT LOSING	$87	MONEY/WALLET/PURSE ($43)	HAIR ($23)	TEETH ($10)	KEYS ($7)	WEIGHT ($4)
5	YOU DRINK LOTS OF	$94	WATER ($51)	COFFEE ($20)	TEA ($10)	SODA[+POP]/COKE/PEPSI/POP ($7)	MILK ($6)
3	YOU GET FROM A WELL	$100	WATER ($75)	OIL ($19)	WISH ($6)
6	NAUGHTY THING CHILDREN DO THAT SHOULD GET THE MOST PUNISHMENT	$88	LIE ($33)	STEAL ($14)	TALK+BACK ($13)	SWEAR/CURSE ($11)	DISOBEY ($10)	FIGHT ($7)
4	THAT MAKES A CRASHING NOISE	$86	BREAK[ING]+(DISH/GLASS) ($38)	[CAR/AUTO*]+ACCIDENT ($30)	THUNDER[+STORM]/STORM ($12)	CYMBAL ($6)
4	ABOUT WHICH FRIENDS ASK FOR *YOUR HONEST OPINION*	$91	CLOTHES ($34)	LOOKS/APPEARANCE ($32)	[NEW+]HAIRDO/[* ]HAIR* ($20)	MARRIAGE ($5)
3	TYPE OF BOOK THAT CAN BE FOUND IN JUST ABOUT EVERY HOUSEHOLD	$94	BIBLE/* BIBLE ($42)	COOKBOOK ($37)	DICTIONARY ($15)
6	IN NATURE THAT SCARES THE HECK OUT OF YOU	$83	SNAKE ($28)	LIGHTNING[ *]/ELECTRICAL[ *]/THUNDER[+STORM] ($20)	[WIND]STORM/TORNADO/HURRICANE ($16)	SPIDER ($11)	EARTHQUAKE ($5)	BAT ($3)
7	BESIDES A STOP SIGN NAME A SIGN ON A CITY STREET	$88	YIELD ($34)	SPEED+LIMIT ($18)	ONE+WAY ($11)	[STREET+]NAME ($11)	NO+PARKING ($8)	SLOW ($3)	BUS+STOP ($3)
4	WHO WOULD YOU CROWN AS *THE WORLD'S GREATEST ALL-TIME ENTERTAINER*	$68	BOB+HOPE ($46)	ELVIS[+PRESLEY] ($10)	SAMMY+DAVIS[+JR] ($6)	[FRANK+]SINATRA ($6)
4	PEOPLE USE SEASHELLS TO MAKE	$88	JEWELRY ($69)	ASH+TRAY ($15)	LAMPS ($2)	PLANTERS ($2)
7	YOU'VE BEEN BITTEN BY	$98	MOSQUITO ($46)	DOG ($30)	BEE ($9)	SPIDER ($7)	ANT ($2)	PARROT/BIRD ($2)	PERSON/BABY/HUMAN ($2)
5	THAT CAN LOOK SCRAGGLY IF NOT PROPERLY CARED FOR	$94	HAIR/WIG ($67)	PET/CAT/DOG ($11)	LAWN ($8)	BEARD ($5)	CLOTHES ($3)
6	DOOR INSIDE THE HOUSE THAT YOU KEEP SHUT	$98	CLOSET ($54)	BASEMENT/CELLAR ($15)	BATHROOM ($15)	FRIDGE/REFRIGERATOR/ICEBOX ($7)	BEDROOM ($5)	CUPBOARD/CABINET ($2)
8	APPLIANCE IN YOUR HOME MOST IN NEED OF REPLACEMENT	$91	TOASTER ($27)	STOVE/OVEN/RANGE ($13)	WASH(ER/ING+MACHINE) ($12)	FRIDGE/REFRIGERATOR/ICEBOX ($10)	TV[+SET]/TELEVISION ($10)	CAN+OPENER ($7)	VACUUM ($7)	DISHWASHER ($5)
4	FRUIT THAT SHAMPOOS SMELL LIKE	$95	STRAWBERRY ($57)	LEMON ($26)	APPLE ($8)	APRICOT ($4)
4	IN WHICH YOU COULD SEE FOOTPRINTS	$100	SNOW ($50)	SAND ($31)	MUD/DIRT ($16)	CEMENT ($3)
5	SPORT THAT REALLY CAUGHT ON IN THE LAST FEW YEARS	$75	SOCCER ($40)	TENNIS ($14)	RAC(QU/K)ETBALL ($10)	[ROLLER+/ICE+]SKATING ($7)	HOCKEY ($4)
4	FOOD THAT PREGNANT WOMEN CRAVE	$94	PICKLES ($71)	ICE+CREAM ($18)	WATERMELON ($3)	PIZZA ($2)
5	MEAT YOU BUY IN A CAN	$87	HAM ($56)	SPAM ($11)	TUNA ($10)	CHICKEN ($5)	CORNED+BEEF ($5)
5	DESIGNED TO HOLD A BABY	$93	CRIB ($54)	CARRIAGE/STROLLER/PRAM ($24)	CRADLE ($7)	CAR+SEAT ($6)	HIGH+CHAIR ($2)
6	THAT'S HARD TO SWEEP UP WHEN YOU SPILL IT	$87	SUGAR ($57)	FLOUR ($10)	EGGS ($6)	MILK ($6)	MERCURY ($4)	SALT ($4)
5	THAT GETS TUNED	$97	PIANO ($43)	CAR/AUTO*/ENGINE ($26)	RADIO/STEREO ($14)	GUITAR ($10)	TV[+SET]/TELEVISION ($4)
6	SIGN YOU SEE IN DEPARTMENT STORES	$75	SALE ($51)	EXIT ($8)	SHOPLIFTERS ($5)	NO+SMOKING ($4)	SHOES ($4)	ESCALATOR ($3)
6	YOU SEE ON THE SCREEN BEFORE THE MOVIE STARTS	$95	CREDITS ($32)	PREVIEW/[COMING+]ATTRACTIONS ($23)	TITLE ($20)	CARTOONs ($10)	ADS/COMMERCIALs ($7)	[MOVIE+]RATING ($3)
3	WHERE IS THE DOG'S FAVORITE PLACE TO SLEEP IN THE HOUSE	$87	FURNITURE/CHAIR/SOFA/BED/COUCH ($67)	FIREPLACE/HEARTH ($10)	STOVE/HEATER ($10)
5	COLOR OF CAKE FROSTING	$99	WHITE/VANILLA ($55)	BROWN/CHOCOLATE ($31)	PINK ($7)	YELLOW ($4)	BLUE ($2)
5	COMPLAINT MANY TENANTS HAVE ABOUT THEIR APARTMENTS	$90	[NOISY/LOUD]+NEIGHBORS/NOIS(E/Y) ($30)	PLUMBING ($17)	HIGH+RENT ($16)	NO+HEAT/COLD ($14)	TOO+SMALL ($13)
6	GIVE ANOTHER WORD FOR *UGLY*	$78	GROSS ($32)	HOMELY ($21)	HIDEOUS ($9)	UNATTRACTIVE ($7)	REPULSIVE ($5)	HORRIBLE ($4)
6	KIDS TAKE WITH THEM WHEN THEY MOVE OUT OF THE HOUSE	$95	CLOTHES ($42)	STEREO ($18)	TOYS/STUFFED+ANIMALs ($16)	FURNITURE ($12)	TV[+SET]/TELEVISION ($5)	PETs/DOG/CAT ($2)
5	PLACE WHERE SIGNS ARE IN SEVERAL LANGUAGES	$86	AIRPORT/TERMINAL ($65)	BORDER ($6)	RESTAURANT ($6)	BATHROOM ($5)	UN/UNITED+NATIONS ($4)
4	PURCHASE PEOPLE LIKE TO SHOW OFF TO THEIR FRIENDS	$97	CAR/AUTO* ($83)	CLOTHES ($7)	JEWELRY/DIAMOND ($4)	FURNITURE ($3)
4	A FOOTBALL PLAYER WEARS	$99	HELMET ($76)	PADS ($16)	JERSEY ($4)	[ATHLETIC+]SUPPORTER/JOCK[+STRAP] ($3)
5	PIECE OF JEWELRY PEOPLE HAVE ENGRAVED	$97	BRACELET ($34)	RING ($31)	WATCH ($22)	LOCKET ($5)	NECKLACE ($5)
9	SPORT THAT REQUIRES SPECIAL SHOES	$99	FOOTBALL ($30)	BASEBALL ($19)	TENNIS ($16)	BOWLING ($11)	GOLF ($8)	TRACK ($6)	BASKETBALL ($5)	SKATING ($2)	SOCCER ($2)
10	FAST-PACED SPORT	$93	HOCKEY ($21)	BASKETBALL ($17)	(CAR/AUTO)+RAC(E/ING)/RAC(ING/E)+CARS ($17)	TENNIS ($10)	TRACK ($9)	SOCCER ($7)	JAI+ALAI/HILI ($4)	HANDBALL ($3)	HORSE+RAC(E/ING) ($3)	FOOTBALL ($2)
4	HOLIDAY THAT HAS SPECIAL COLORS ASSOCIATED WITH IT	$100	(CHRIST/X+)MAS ($74)	VALENTINE[']S[+DAY] ($11)	HALLOWEEN ($8)	S[AIN]T+PA(DDY/TRICK)s ($7)
5	DEVICE USED FOR CUTTING	$95	SCISSORs/SHEARs ($44)	KNIFE ($36)	SAW ($9)	RAZOR ($4)	LAWN+MOWER ($2)
8	DEVICE YOU LOOK THROUGH	$88	TELESCOPE ($26)	MICROSCOPE ($18)	BINOCULARS ($15)	[EYE+]GLASS[ES] ($11)	WINDOW ($8)	KEYHOLE ($4)	CAMERA ($3)	PERISCOPE ($3)
4	FAMOUS NEWS MAGAZINE	$100	TIME ($47)	NEWSWEEK ($46)	US+NEWS ($5)	PEOPLE ($2)
8	STATE WITH GREAT TOURIST ATTRACTIONS	$95	CALIFORNIA/CA ($37)	FLORIDA/FL ($31)	NEW+YORK/NY ($11)	HAWAII/HI ($5)	ARIZONA/AZ ($3)	COLORADO/CO ($3)	NEVADA/NV ($3)	MAINE/ME ($2)
5	FLAVOR OF JELLY	$96	STRAWBERRY ($26)	GRAPE ($24)	CHERRY ($22)	RASpBERRY ($19)	BLUEBERRY ($5)
5	BEST SEASON OF THE YEAR	$100	SUMMER ($38)	SPRING ($29)	FALL/AUTUMN ($20)	WINTER ($11)	(CHRIST/X+)MAS ($2)
5	QUIETEST PLACE IN YOUR HOUSE	$98	BEDROOM ($46)	BATHROOM ($43)	BASEMENT/CELLAR ($4)	DEN/STUDY ($3)	ATTIC ($2)
4	JOB IN A HOTEL	$96	BELL+(HOP/BOY/MAN/*) ($46)	[DESK+]CLERK ($24)	MAID/HOUSEKEEPER ($23)	MANAGER ($3)
10	WHAT IS THE WEIGHT IN POUNDS OF THE AVERAGE MAN	$96	175 ($19)	180 ($19)	160 ($18)	170 ($12)	150 ($7)	165 ($7)	185 ($7)	140 ($3)	155 ($2)	200 ($2)
3	GIVE ME A WORD FOR *MISTER* IN A FOREIGN LANGUAGE	$100	SENOR ($72)	M(ONSI/IS)EUR ($22)	H(ER/AI)R ($6)
5	COLOR OF JELLY BEANS	$97	RED ($58)	BLACK ($22)	GREEN ($8)	PINK ($5)	YELLOW ($4)
10	TV PROGRAMS ARE REALLY WORTH WATCHING	$93	5 ($29)	10 ($18)	3 ($14)	6 ($9)	4 ($8)	2 ($5)	20 ($4)	0 ($2)	7 ($2)	15 ($2)
10	FOOD THAT MIGHT BE EITHER BROWN OR WHITE	$97	BREAD ($38)	RICE ($27)	SUGAR ($7)	EGGS ($5)	POTATOES ($5)	CAKE ($4)	CHOCOLATE ($3)	GRAVY ($3)	ICE+CREAM ($3)	TURKEY ($2)
12	SPORT THAT REQUIRES A GOOD ARM	$98	BASEBALL ($40)	TENNIS ($12)	ARM+WRESTL(E/ING) ($8)	BOXING ($7)	FOOTBALL ($7)	[LIFT+]WEIGHT ($7)	SHOT+PUT ($4)	ARCHERY ($3)	BOWLING ($3)	POLE+VAULT ($3)	DISCUS[+THROW] ($2)	WRESTLING ($2)
6	COMMON COLOR OF BIRDS	$100	BROWN ($43)	BLUE ($27)	BLACK ($17)	GR(A/E)Y ($6)	RED ($4)	YELLOW ($3)
8	PLACE WHERE PEOPLE SPEND HOURS DAYDREAMING	$89	PARK ($32)	SCHOOL ($25)	HOME ($13)	BEACH ($8)	CAR ($4)	JOB/WORK/OFFICE ($3)	HAMMOCK ($2)	LAKE ($2)
8	CARD GAME WITH A ONE-WORD NAME	$89	POKER ($51)	BRIDGE ($15)	PINOCHLE ($6)	SOLITAIRE ($6)	CANASTA ($3)	EUCHRE/EUKER ($3)	RUMMY/GIN ($3)	FISH ($2)
7	SPECIFIC OCCASION WHEN RELATIVES VISIT	$97	(CHRIST/X+)MAS ($37)	BIRTHDAY ($25)	THANKSGIVING ($17)	WEDDING/MARRIAGE ($8)	FUNERAL/DEATH ($4)	EASTER ($3)	[FAMILY+]REUNION ($3)
7	TYPE OF TABLE	$95	COFFEE/COCKTAIL ($31)	DINING/KITCHEN ($22)	POOL ($18)	CARD/FOLDING/POKER ($14)	TIME+TABLE ($4)	END ($3)	PING+PONG/TABLE+TENNIS ($3)
4	PEOPLE USE ON THEIR HANDS	$99	LOTION/CREAM ($56)	SOAP ($29)	GLOVES ($12)	[[FINGER]NAIL+]POLISH ($2)
4	SHOE SOLES ARE MADE OF	$98	LEATHER ($52)	RUBBER ($41)	CORK ($3)	PLASTIC ($2)
4	SPORT IN WHICH THE PLAYERS WEAR NO HEADGEAR	$88	BASKETBALL ($38)	TENNIS ($21)	SOCCER ($20)	GOLF ($9)
4	PART OF A CAR THAT MAKES NOISE	$90	ENGINE/MOTOR ($36)	MUFFLER ($34)	HORN ($16)	RADIO ($4)
6	WEAPON USED IN ANCIENT TIMES	$86	SPEAR/LANCE/JAVELIN ($29)	SWORD ($25)	BOW&ARROW/BOW/BOW[+AND]+ARROW ($13)	CLUB ($8)	STONEs/ROCK ($6)	CATAPULT ($5)
5	PLACE PEOPLE DESCRIBE AS AN *ISLAND PARADISE*	$98	HAWAII ($77)	TAHITI ($9)	BAHAMAS/NASSAU ($8)	BERMUDA ($2)	VIRGIN+ISL[ANDs] ($2)
4	SPECIFIC LEFTOVER THAT MAKES GREAT SANDWICHES	$94	[ROAST+]BEEF ($38)	MEAT+LOAF ($22)	TURKEY ($20)	HAM ($14)
7	SAINT THAT MANY CHILDREN ARE NAMED AFTER	$80	CHRISTOPHER ($22)	PETER ($18)	MARY ($15)	JOHN ($12)	JOSEPH ($6)	PATRICK ($4)	ANN ($3)
8	MAN'S FIRST NAME THAT BEGINS WITH THE LETTER *R*	$92	ROBERT ($55)	RICHARD ($18)	RONALD ($6)	RAYMOND ($4)	RALPH ($3)	RANDOLPH ($2)	RODNEY ($2)	ROGER ($2)
10	FRUIT WITH THE BEST FRAGRANCE	$99	ORANGE ($28)	STRAWBERRY ($23)	LEMON ($13)	PEACH ($13)	APPLE ($6)	BANANA ($5)	WATERMELON ($4)	PINEAPPLE ($3)	CANTALOUPE ($2)	LIME ($2)
4	COMIC BOOK SUPER-HERO WHO CAME TO LIFE ON A TV SCREEN	$95	SUPERMAN ($82)	BATMAN ($7)	WONDER+WOMAN ($4)	SPIDERMAN ($2)
5	ANIMAL THAT CAN KILL WITH ITS BITE	$91	SNAKE ($66)	LION ($14)	SHARK ($4)	TIGER ($4)	WOLF ($3)
5	SOLDIERS POLISH	$97	BOOTS ($33)	SHOES ($31)	GUN ($23)	BRASS/BUTTONS/[BELT+]BUCKLE ($8)	MEDALS ($2)
5	THAT COMES LIME FLAVORED	$94	GELATIN/JELLO ($34)	ICE+CREAM/SHERBET/POPSICLE ($25)	[SODA+]POP ($17)	CANDY ($14)	KOOL+AID ($4)
5	SPORT IN WHICH PEOPLE GET KNOCKED DOWN	$98	FOOTBALL ($64)	BOXING ($25)	HOCKEY ($4)	SOCCER ($3)	ROLLER+DERBY/ROLLER+SKAT(E/ING) ($2)
5	FRUIT USED TO FLAVOR PANCAKE SYRUP	$88	BLUEBERRY ($54)	STRAWBERRY ($22)	APRICOT ($4)	BLACKBERRY ($4)	BOYSENBERRY ($4)
5	OCCASION AFTER WHICH YOU WRITE MANY THANK-YOU NOTES	$96	WEDDING/MARRIAGE ($63)	(CHRIST/X+)MAS ($13)	[B(ABY/RIDAL)+]SHOWER ($9)	BIRTHDAY ($7)	GRADUATION ($4)
6	WAY THAT PEOPLE SHOW JOY	$97	LAUGH ($33)	SMILE ($30)	CRY ($19)	HUG ($6)	JUMP ($6)	SING ($3)
4	PLACE ON A PERSON'S BODY YOU MIGHT SEE A DIAMOND	$100	FINGER/HAND ($86)	EAR ($6)	NAVEL/BELLY+BUTTON ($4)	NECK/THROAT ($4)
4	COMMON COLOR FOR BATHROBES	$94	BLUE/NAVY ($75)	BROWN ($9)	PINK ($6)	WHITE ($4)
6	FRUIT USED IN YOGURT	$97	STRAWBERRY ($64)	PEACH ($14)	BLUEBERRY ($10)	PINEAPPLE ($4)	CHERRY ($3)	RASpBERRY ($2)
6	IN THE KITCHEN THAT MAKES A LOT OF NOISE	$91	BLENDER/MIXER ($50)	[GARBAGE+]DISPOSAL ($16)	DISHWASHER ($12)	CAN+OPENER ($6)	TEA+(POT/KETTLE) ($4)	FAN ($3)
5	PLACE IN WHICH YOU MIGHT COMPLAIN TO THE MANAGER	$98	RESTAURANT ($73)	(H/M)OTEL ($11)	[GROCERY+]STORE/[SUPER+]MARKET ($7)	APT BLDG/AP[ARTMEN]T[ *] ($4)	MOVIE/THEATER ($3)
4	PEOPLE LEASE	$99	APARTMENT/HOUSE ($64)	CAR/AUTO* ($29)	STORE ($4)	OFFICE[+SPACE] ($2)
6	THAT GETS FOLDED AFTER IT'S LAUNDERED	$94	TOWEL ($51)	SHIRT/BLOUSE ($14)	SHEET ($12)	UNDERWEAR ($8)	PANTS/SLACKS ($5)	HAN(KY/DKERCHIEF) ($4)
5	PEOPLE BUY FOR A HORSE	$98	SADDLE ($60)	FEED/HAY/FOOD ($32)	BLANKET ($2)	BRIDLE/HALTER ($2)	SALT BLOCKs ($2)
6	GOOD HOBBY FOR SOMEONE WHO LIKES TO BE ALONE	$83	READING ($29)	STAMPS ($24)	MODELS ($10)	PAINTING/DRAW ($10)	COINS ($5)	SEWING/KNIT ($5)
5	A FATHER BUILDS FOR HIS KIDS	$83	(PLAY/TREE)+HOUSE ($63)	SWING ($7)	MODELS ($5)	DOLL+HOUSE ($4)	TOY+(CHEST/BOX) ($4)
4	TYPE OF COOKIE THAT PEOPLE BAKE AT HOME	$99	CHOC[OLATE]+CHIP ($87)	OATMEAL ($8)	P[EA]NUT+BUTTER ($2)	SUGAR ($2)
6	YOU MAKE WITH EGGS	$94	CAKEs ($47)	OMELET ($31)	COOKIEs ($6)	EGGNOG ($5)	FR[ENCH]+TOAST ($3)	CUSTARD ($2)
6	THAT HAS A BUILT-IN FAN	$92	CAR/AUTO* ($32)	AIR+COND[ITIONER]/AC ($26)	STOVE/RANGE/OVEN ($10)	FRIDGE/REFRIGERATOR ($9)	FURNACE/HEATER ($8)	HAIR+DRYER/BLOW(ER/+DRYER) ($7)
7	FLAT	$82	TABLE ($27)	PANCAKE ($22)	TIRE ($10)	DESERT ($7)	FLOOR ($7)	CHEST ($6)	BOARD ($3)
4	A SPORTSMAN SWINGS	$100	BAT ($46)	[GOLF+]CLUB ($37)	FISHING+(ROD/POLE) ($11)	RAC(QU/K)ET ($6)
4	YOU SHOULD JOT DOWN WHEN YOU WITNESS A CRIME	$98	DESCRIPTION ($48)	(LICENSE/TAG)+NUMBER ($34)	TIME/HOUR ($13)	LOCATION/PLACE ($3)
5	PEOPLE BURN ON PURPOSE	$84	FIREWOOD ($27)	TRASH/GARBAGE ($23)	LEAVES ($14)	CANDLES ($13)	CIGARETTES ($7)
6	PEOPLE TAKE IN A CARRY-ON BAG ON AN AIRPLANE	$90	BOOKS/MAGAZINES/READ ($32)	COSMETICS/TOILETRIES/MAKE+UP ($24)	MEDICINE/PILLS/DRUGS ($11)	CAMERA ($10)	CLOTHES ($7)	FOOD/SNACKs ($6)
4	THAT HELPS A STUDENT GET GOOD GRADES	$83	STUDYING ($71)	CHEATING/COPYING ($6)	CALCULATOR ($3)	[GOOD+]MEMORY ($3)
5	TYPE OF PERSON WHO SPEAKS AT GRADUATION CEREMONIES	$74	POLITICIAN ($24)	PRINCIPAL ($23)	VALEDICT[ORIAN]/STUDENT ($11)	CLERGYMAN/PRIEST/MINISTER/RABBI ($9)	PROFESSOR ($7)
9	MAN'S HOBBY	$91	FISHING ($32)	GOLF[ING] ($18)	CARPENTRY/WOODWORK ($12)	CARS/AUTO* ($9)	HUNTING ($9)	COINS ($4)	MODEL+[AIR]PLANES/MODELS ($3)	BOWLING ($2)	GUNS ($2)
8	COUNTRY MANY IMMIGRANTS COME FROM	$96	MEXICO ($28)	ITALY ($20)	CUBA ($16)	VIETNAM ($10)	GERMANY ($9)	POLAND ($8)	IRELAND ($3)	RUSSIA/USSR/SOVIET+UNION ($2)
7	WHICH SPOTS A CARPET	$77	PETS/DOGS/CATS ($31)	COFFEE ($13)	WINE ($8)	OIL/GREASE ($7)	SODA[+POP]/COKE/PEPSI/POP ($6)	INK ($6)	MUD ($6)
4	BATMAN HAD ROBIN NAME ANOTHER FAMOUS CRIMEFIGHTER'S SIDEKICK	$98	TONTO ($71)	WATSON ($19)	KATO ($4)	LOIS+LANE ($4)
5	THAT HAS A SERIAL NUMBER	$85	CAR/AUTO* ($47)	TV[+SET]/TELEVISION ($28)	DOLLARS/MONEY/CASH ($4)	GUN ($3)	STEREO/RADIO ($3)
8	YOU MIGHT HEAR WHEN EVERYTHING IS VERY STILL AT NIGHT	$83	CRICKETS ($38)	DOG[+BARK[ING]]/BARK* ($10)	(WATER/FAUCET)+*/DRIP* ($9)	HOUSE[+SETTLE] ($7)	CLOCK[+TICK] ($6)	(CAR/TRAFFIC)+* ($5)	FROGs ($4)	OWLs ($4)
7	YOU CAN BUY *CHILD SIZE*	$92	CLOTHING ($40)	DINNERs/MEAL/FOOD ($21)	SHOES ($14)	FURNITURE ($6)	[TOOTH+]BRUSH ($5)	ASPIRIN ($4)	(BI/TRI)(CYCLE/KE) ($2)
5	BESIDES A CAR THAT MIGHT BE A *LEMON*	$85	TV[+SET]/TELEVISION ($46)	HO(USE/ME) ($16)	WASH(ER/ING+MACHINE) ($12)	FRIDGE/REFRIGERATOR ($6)	STEREO/RECORD+PLAYER ($5)
4	THAT GETS PLUGGED UP	$93	SINK/DRAIN ($80)	TOILET ($6)	NOSE ($5)	PIPE ($2)
7	MEMENTO OF A MEMORABLE DATE THAT PEOPLE SAVE	$81	FLOWERS/CORSAGE ($36)	TICKET+STUB ($10)	PICTUREs/PHOTO[GRAPH]s ($9)	NAPKINs ($8)	MATCHES ($7)	CAKE[+TOPs] ($6)	PROGRAMs ($5)
6	FOOD PEOPLE EAT IN BARS	$95	PRETZELs ($33)	PEANUTs ($27)	POPCORN ($22)	[POTATO+]CHIPs ($5)	SANDWICH[ES]/[HAM]BURGERs ($5)	PIZZAs ($3)
5	PEOPLE MIGHT USE AS A SUBSTITUTE FOR POKER CHIPS	$92	COINS ($40)	MATCH(STICK/E)S ($29)	TOOTH+PICKS ($10)	BUTTONS ($9)	[DRY+]BEANS ($4)
3	KIDS THROW THROUGH THE AIR	$97	BALL ($40)	FRISBEE ($40)	[PAPER+][AIR]PLANE ($17)
4	YOU USE TO FRY FISH	$96	OIL ($44)	[FRYING+]PAN ($41)	FLOUR ($6)	CORN+MEAL ($5)
4	FLOWER YOU COULD RECOGNIZE BY ITS SCENT	$97	ROSE ($86)	CARNATION ($6)	GARDENIA ($3)	LILAC ($2)
4	ARTICLE OF CLOTHING MEN BUY IN LOUD PRINTS	$94	SHIRTs ($68)	TIEs ($20)	UNDERWEAR/BOXER[+SHORTs] ($4)	PANTS ($2)
4	WAY YOU CAN TELL THAT FOOD HAS GONE BAD	$100	SMELL/ODOR ($74)	MOLD/MILDEW ($16)	COLOR/SIGHT/LOOK/APPEARANCE ($6)	TASTE ($4)
4	THAT COMES OUT OF A MINE	$97	COAL ($60)	GOLD ($24)	DIAMONDS ($10)	SILVER ($3)
6	PEOPLE WASH WITH A SPONGE	$95	CARS/AUTO* ($58)	DISHES/POTS/PANS/GLASSES ($16)	COUNTERs/TABLEs/DRAIN+BOARDs ($8)	SINKs/BASINs ($8)	BATHTUB ($3)	WALLs ($2)
3	PEOPLE *GIVE UP*	$82	SMOKING/CIGARETTE ($66)	FOOD/DESSERT/EATING ($9)	CANDY/SWEETS ($7)
8	POPULAR FORM OF RECREATION	$87	TENNIS ($34)	BASEBALL ($13)	GOLF ($13)	SWIMMING ($9)	CAMPING ($5)	SKIING ($5)	BOWLING ($4)	FOOTBALL ($4)
6	YOU HAVE AT HOME THAT YOU WISH YOU COULD HAVE IN YOUR CAR	$94	TV[+SET]/TELEVISION ($36)	[TELE]PHONE ($22)	BATHROOM/TOILET ($15)	STEREO/TAPE/CD ($9)	FRIDGE/REFRIGERATOR ($8)	BED ($4)
5	THAT SQUIRTS WATER	$99	(WATER/SQUIRT)+(GUN/PISTOL) ($62)	[GARDEN+]HOSE ($27)	FOUNTAINs ($5)	[SPRAY+]BOTTLE ($3)	FAUCET ($2)
5	PLACE PEOPLE WOULD LIKE TO VISIT AT LEAST ONCE IN THEIR LIFE	$88	HAWAII ($35)	EUROPE ($32)	DISNEYLAND ($9)	WASHINGTON ($9)	NEW+YORK/NY ($3)
4	MADE OF TORTOISE SHELL	$90	JEWELRY/NECKLACEs/EARRINGs ($46)	ASH+TRAYs ($18)	[HAIR+](COMB/BRUSH) ($15)	GLASSES/FRAMES ($11)
5	SPORT OR ACTIVITY AT WHICH KIDS GET MANY INJURIES	$94	FOOTBALL ($70)	SKATEBOARD ($15)	BASEBALL ($3)	CLIMBING[+TREEs] ($3)	HOCKEY ($3)
5	PART OF THE BODY THAT PEOPLE CROSS	$99	LEGS/FEET ($50)	HEART ($28)	FINGERS ($16)	ARMS ($3)	EYES ($2)
4	GOOD PLACE IN THE HOUSE FOR A NIGHT LIGHT	$98	BATHROOM ($47)	HALLWAY ($36)	BED+ROOM ($10)	(CHILD/KID)[']S+ROOM/NURSERY ($5)
5	THAT LITTERBUGS THROW OUT OF CAR WINDOWS	$89	CIGARETTEs/BUTTs ($31)	CANs ($29)	BOTTLEs ($10)	[PAPER+]CUPs ($10)	WRAPPERs ($9)
3	BESIDES COOKIES THAT PEOPLE KEEP IN A COOKIE JAR	$95	MONEY/CASH ($80)	CANDY ($12)	BROWNIES ($3)
6	PEOPLE WEAR THAT IS MADE OF PLASTIC	$94	RAIN+(WEAR/COAT) ($37)	GLASSES ($34)	OVERSHOEs/SHOE/BOOT/GALOSHES ($8)	JEWELRY ($6)	BARRETTES ($5)	BELTs ($4)
5	NEW EXPENSE THAT COMES WITH A NEW BABY	$98	DIAPERS ($40)	[BABY+]FOOD ($21)	CLOTHES ($17)	DOCTOR/HOSPITAL/PHYSICIAN/PEDIATRICIAN ($15)	CRIB/FURNITURE ($5)
3	A FLASHY PERSON OWNS THAT MAKES HIM LOOK FLASHY	$94	CAR/AUTO* ($51)	CLOTHES ($22)	JEWELRY ($21)
